repo_name,pr_title,pr_url,created_at,closed_at,total_comments,total_commits,state
perseus,FEI-3775: Configure wallaby,https://github.com/Khan/perseus/pull/152,2022-04-28T14:38:12Z,2022-04-28T14:51:09Z,4,2,MERGED
perseus,Provide a more appropriate 'staticUrl' mock for storybook,https://github.com/Khan/perseus/pull/248,2022-05-23T22:25:59Z,2022-05-25T20:19:09Z,4,3,MERGED
perseus,FEI-4401.1: Port cypress config from webapp,https://github.com/Khan/perseus/pull/247,2022-05-23T22:13:54Z,2022-05-25T18:30:51Z,8,6,MERGED
perseus,Add storybook!,https://github.com/Khan/perseus/pull/222,2022-05-11T17:28:53Z,2022-05-11T20:48:48Z,8,5,MERGED
perseus,Wonderblock-ify Definition widget,https://github.com/Khan/perseus/pull/220,2022-05-10T20:23:03Z,2022-05-24T19:07:22Z,8,8,MERGED
perseus,Package.json cleanup,https://github.com/Khan/perseus/pull/218,2022-05-09T18:22:01Z,2022-05-09T22:47:41Z,8,6,MERGED
perseus,Fix Storybook so TeX components work,https://github.com/Khan/perseus/pull/274,2022-06-24T18:52:04Z,2022-06-27T17:10:17Z,4,2,MERGED
perseus,"SvgImage: Bundle spinner.gif properly so it can be resolved with webpack, etc.",https://github.com/Khan/perseus/pull/273,2022-06-23T18:10:32Z,2022-06-24T18:55:03Z,7,10,MERGED
perseus,Remove old margin from definition body (Popover manages that now),https://github.com/Khan/perseus/pull/266,2022-06-09T00:01:55Z,2022-06-09T15:55:10Z,4,3,MERGED
perseus,Wonderblockify numeric input,https://github.com/Khan/perseus/pull/278,2022-07-14T19:57:15Z,2022-08-23T20:19:30Z,14,15,MERGED
perseus,show square options instead of circles when the radio widget is a multiselect,https://github.com/Khan/perseus/pull/289,2022-09-28T19:53:33Z,2022-10-05T19:10:06Z,27,9,MERGED
perseus,"Replace ""new"" tooltip with wonderblocks",https://github.com/Khan/perseus/pull/285,2022-09-20T03:22:42Z,2022-09-28T18:36:44Z,11,5,MERGED
perseus,Add test:no-console-mock script to disable console mocking in test-setup.js,https://github.com/Khan/perseus/pull/302,2022-10-07T21:36:48Z,2022-10-10T15:19:00Z,7,5,MERGED
perseus,Perseus Playground basic site Layout,https://github.com/Khan/perseus/pull/325,2022-11-30T22:32:47Z,2023-02-07T20:03:19Z,6,3,CLOSED
perseus,Highlight tooltip storybook,https://github.com/Khan/perseus/pull/319,2022-11-18T23:11:16Z,2023-01-03T18:53:17Z,7,3,CLOSED
perseus,Update perseus fonts to match wonderblocks,https://github.com/Khan/perseus/pull/318,2022-11-16T19:58:32Z,2022-11-22T19:56:13Z,12,3,MERGED
perseus,nudge the icon to the right and fix icon size,https://github.com/Khan/perseus/pull/342,2022-12-20T19:24:21Z,2022-12-20T21:27:19Z,4,3,MERGED
perseus,add a story for the hints renderer,https://github.com/Khan/perseus/pull/341,2022-12-19T18:27:03Z,2022-12-20T15:37:41Z,5,2,MERGED
perseus,add text-indent back to Passage,https://github.com/Khan/perseus/pull/339,2022-12-16T20:36:00Z,2022-12-16T21:17:10Z,4,2,MERGED
perseus,wip: fixup crossout,https://github.com/Khan/perseus/pull/338,2022-12-14T17:44:10Z,2023-01-03T17:05:00Z,4,1,MERGED
perseus,Ensure that there is sufficient contrast between the graded-group title and the background.,https://github.com/Khan/perseus/pull/336,2022-12-14T16:36:49Z,2022-12-14T21:09:53Z,5,4,MERGED
perseus,Restore custom input styles back into the Matrix,https://github.com/Khan/perseus/pull/332,2022-12-12T22:02:20Z,2022-12-13T21:29:22Z,6,5,MERGED
perseus,Allow numeric-input to change size and text alignment,https://github.com/Khan/perseus/pull/330,2022-12-08T21:28:23Z,2022-12-13T21:35:09Z,8,10,MERGED
perseus,Add basic interactive story for numeric-input,https://github.com/Khan/perseus/pull/327,2022-12-01T22:31:28Z,2022-12-05T15:44:50Z,5,2,MERGED
perseus,Create an demo story show how to integrate the on-screen keypad with ItemRenderer,https://github.com/Khan/perseus/pull/371,2023-01-30T23:45:08Z,2023-02-24T17:47:40Z,7,5,MERGED
perseus,Fix KaTeX rendering in Storybook,https://github.com/Khan/perseus/pull/367,2023-01-25T20:16:40Z,2023-02-24T01:04:29Z,8,7,MERGED
perseus,"Shape the ""cross out"" ellipsis button",https://github.com/Khan/perseus/pull/363,2023-01-24T23:00:25Z,2023-01-25T14:08:20Z,4,3,MERGED
perseus,[🔥AUDIT🔥] some style tweaks,https://github.com/Khan/perseus/pull/362,2023-01-24T20:17:54Z,2023-01-24T20:29:00Z,4,2,MERGED
perseus,"Update categorizer to have no empty ""th"" cells per a11y audit",https://github.com/Khan/perseus/pull/355,2023-01-11T18:55:12Z,2023-02-24T14:48:17Z,6,6,MERGED
perseus,bugfix: passage numbers stop abruptly,https://github.com/Khan/perseus/pull/354,2023-01-10T16:20:57Z,2023-01-10T23:12:21Z,5,7,MERGED
perseus,Fix passage text by making it exactly like it was before,https://github.com/Khan/perseus/pull/352,2023-01-09T20:43:12Z,2023-01-10T16:41:14Z,4,3,MERGED
perseus,Remove gradient background on math,https://github.com/Khan/perseus/pull/345,2023-01-04T18:26:54Z,2023-01-05T17:52:01Z,6,2,MERGED
perseus,Update fonts from Noto -> Lato,https://github.com/Khan/perseus/pull/344,2023-01-04T18:15:58Z,2023-01-05T21:20:46Z,7,2,MERGED
perseus,LC-520: Make correctness checks explicit comparisons to true/false,https://github.com/Khan/perseus/pull/386,2023-02-22T23:00:04Z,2023-02-22T23:29:23Z,4,2,MERGED
perseus,LC-520-4: Fix width and rightAlign options for input-number widget,https://github.com/Khan/perseus/pull/383,2023-02-21T20:09:24Z,2023-02-21T22:58:19Z,7,4,MERGED
perseus,LC-520-2: Add two more controls to input-number Story,https://github.com/Khan/perseus/pull/381,2023-02-21T19:53:32Z,2023-02-21T21:07:47Z,4,4,MERGED
perseus,"Fix fonts on ""Choose 1 answer""",https://github.com/Khan/perseus/pull/377,2023-02-15T22:01:45Z,2023-02-24T17:49:22Z,4,2,MERGED
perseus,PROTOTYPE: Keypad on desktop,https://github.com/Khan/perseus/pull/374,2023-02-09T21:40:12Z,2023-06-06T19:46:57Z,1,1,CLOSED
perseus,Try v8 coverage provider for jest,https://github.com/Khan/perseus/pull/372,2023-02-03T23:23:12Z,2023-02-08T17:33:30Z,8,7,MERGED
perseus,FEI-4967.11: Fix Storybook config,https://github.com/Khan/perseus/pull/446,2023-03-29T18:03:02Z,2023-03-29T19:37:11Z,4,1,MERGED
perseus,[rm-input-number] 5 - Fix Storybook stories,https://github.com/Khan/perseus/pull/434,2023-03-24T18:20:16Z,2024-11-14T05:43:58Z,4,8,CLOSED
perseus,Publish npm snapshot on pull request create/update,https://github.com/Khan/perseus/pull/413,2023-03-14T23:16:56Z,2023-03-16T22:50:21Z,12,25,MERGED
perseus,bugfix: add a font-size exception for the definition prompt,https://github.com/Khan/perseus/pull/411,2023-03-13T18:10:23Z,2023-03-13T19:25:54Z,6,5,MERGED
perseus,bugfix: definition text smaller than surrounding text,https://github.com/Khan/perseus/pull/404,2023-03-08T21:29:20Z,2023-03-10T16:44:17Z,4,7,MERGED
perseus,bugfix: oversized text in SVG images with Graphie text,https://github.com/Khan/perseus/pull/398,2023-03-07T20:04:16Z,2023-03-10T17:02:00Z,6,5,MERGED
perseus,[Remove SAT] Remove satStyling from hint-renderer,https://github.com/Khan/perseus/pull/394,2023-03-06T21:31:43Z,2023-03-07T17:39:47Z,6,5,MERGED
perseus,Enumify many types in math-input,https://github.com/Khan/perseus/pull/501,2023-04-28T19:19:47Z,2023-05-01T18:26:46Z,15,15,MERGED
perseus,Type and modernize sortable.tsx,https://github.com/Khan/perseus/pull/495,2023-04-24T20:14:44Z,2023-04-25T23:31:30Z,8,4,MERGED
perseus,Type and modernize tooltip.tsx,https://github.com/Khan/perseus/pull/494,2023-04-24T20:13:36Z,2023-04-25T23:24:56Z,9,3,MERGED
perseus,Type and modernize math-output.tsx,https://github.com/Khan/perseus/pull/493,2023-04-24T20:12:39Z,2023-04-25T23:05:27Z,6,3,MERGED
perseus,Type and modernize lint.tsx,https://github.com/Khan/perseus/pull/492,2023-04-24T20:09:19Z,2023-04-25T22:16:48Z,7,2,MERGED
perseus,Type and modernize hud.tsx,https://github.com/Khan/perseus/pull/490,2023-04-24T20:03:42Z,2023-04-25T22:11:44Z,5,3,MERGED
perseus,Type and modernize graph.tsx,https://github.com/Khan/perseus/pull/489,2023-04-24T19:59:38Z,2023-04-25T22:11:13Z,8,6,MERGED
perseus,Type and modernize FixedToResponsive,https://github.com/Khan/perseus/pull/488,2023-04-24T19:54:47Z,2023-04-25T22:05:24Z,8,3,MERGED
perseus,Remove prop-types from graphie.tsx,https://github.com/Khan/perseus/pull/487,2023-04-24T19:46:54Z,2023-04-25T23:04:23Z,14,9,MERGED
perseus,Add MathInput story to show how the pieces fit together,https://github.com/Khan/perseus/pull/485,2023-04-19T21:20:46Z,2023-04-20T16:23:36Z,5,4,MERGED
perseus,TypeScript: Enable project-wide type checking (experimental),https://github.com/Khan/perseus/pull/471,2023-04-13T19:04:23Z,2023-04-14T18:55:18Z,5,2,MERGED
perseus,Add per-package coverage reporting [work-in-progress],https://github.com/Khan/perseus/pull/465,2023-04-12T14:44:33Z,2023-05-01T15:16:11Z,6,2,CLOSED
perseus,Feature: Interactive Graph Editor,https://github.com/Khan/perseus/pull/555,2023-05-30T16:35:13Z,2023-06-01T17:39:16Z,9,15,MERGED
perseus,Tweak formatting of 'correct answer' in interactive-graph-editor,https://github.com/Khan/perseus/pull/552,2023-05-24T19:39:59Z,2023-05-25T22:24:42Z,5,2,MERGED
perseus,Allow editor to configure 'line segment' graph type,https://github.com/Khan/perseus/pull/551,2023-05-24T18:59:05Z,2023-05-25T22:03:15Z,6,3,MERGED
perseus,Improve Chanegable's types [prototype],https://github.com/Khan/perseus/pull/545,2023-05-19T20:13:17Z,2024-02-06T16:04:41Z,12,3,CLOSED
perseus,Allow editor to configure 'polygon' graph type,https://github.com/Khan/perseus/pull/544,2023-05-19T18:24:06Z,2023-05-25T21:27:51Z,5,2,MERGED
perseus,Allow editor to configure 'points' graph type,https://github.com/Khan/perseus/pull/543,2023-05-19T18:15:58Z,2023-05-25T21:01:41Z,5,3,MERGED
perseus,Re-introduce graph type selector for interactive graph editor,https://github.com/Khan/perseus/pull/542,2023-05-19T18:01:04Z,2023-05-25T19:13:24Z,7,4,MERGED
perseus,Add Editor story for interactive-graph,https://github.com/Khan/perseus/pull/536,2023-05-18T22:41:28Z,2023-05-24T20:15:14Z,7,4,MERGED
perseus,Full key coverage for current pages,https://github.com/Khan/perseus/pull/532,2023-05-16T15:12:23Z,2023-05-16T15:31:02Z,5,1,MERGED
perseus,Replace icons with Phosphor where possible.,https://github.com/Khan/perseus/pull/529,2023-05-15T15:41:58Z,2023-05-16T13:09:15Z,8,8,MERGED
perseus,Add division key option to Numbers page on Keypad,https://github.com/Khan/perseus/pull/516,2023-05-08T21:17:52Z,2023-05-10T14:28:54Z,7,6,MERGED
perseus,"Add Basic Relations buttons, dynamic Keypad and Buttons stories, and use placeholder button instead of throwing an error",https://github.com/Khan/perseus/pull/512,2023-05-08T18:19:59Z,2023-05-08T21:42:40Z,14,6,MERGED
perseus,Add yarn script to generate type coverage report,https://github.com/Khan/perseus/pull/505,2023-05-01T14:54:23Z,2023-05-01T18:18:41Z,6,2,MERGED
perseus,[Perseus] [Khanmigo] Adjust the focus styling on the keypad buttons,https://github.com/Khan/perseus/pull/596,2023-06-29T20:18:34Z,2023-06-29T22:26:48Z,6,2,MERGED
perseus,Convert CursorContext TS enum to POJO,https://github.com/Khan/perseus/pull/593,2023-06-28T19:41:47Z,2023-06-28T20:54:25Z,5,2,MERGED
perseus,Add optional dismiss button to MathInput tabbar,https://github.com/Khan/perseus/pull/584,2023-06-23T21:14:56Z,2023-06-23T21:39:03Z,7,4,MERGED
perseus,Fail PR check if there are STOPSHIPs in any code,https://github.com/Khan/perseus/pull/639,2023-07-28T00:27:17Z,2023-07-31T17:59:40Z,6,11,MERGED
perseus,WIP / Experiment: switch ProvideKeypad to use MobileKeypad,https://github.com/Khan/perseus/pull/628,2023-07-26T13:37:43Z,2023-07-27T15:15:42Z,5,2,CLOSED
perseus,Add story for ExpressionEditor,https://github.com/Khan/perseus/pull/619,2023-07-21T17:26:59Z,2023-07-24T15:52:52Z,6,3,MERGED
perseus,Fix: Image widget editor fails to calculate image dimensions,https://github.com/Khan/perseus/pull/618,2023-07-21T01:37:48Z,2023-07-27T21:03:47Z,12,9,MERGED
perseus,Don't generate a snapshot release for 'Version Packages' PR,https://github.com/Khan/perseus/pull/615,2023-07-17T21:41:41Z,2023-07-18T15:04:11Z,4,3,MERGED
perseus,Changed radio instruction font from serif to sans serif,https://github.com/Khan/perseus/pull/604,2023-07-05T20:37:02Z,2023-07-07T15:48:32Z,5,4,MERGED
perseus,Add ArticleRenderer stories (we didn't have any yet),https://github.com/Khan/perseus/pull/602,2023-07-01T00:26:38Z,2023-07-06T17:36:17Z,8,7,MERGED
perseus,[Analytics] 2. Plumb new DependenciesContext through,https://github.com/Khan/perseus/pull/601,2023-07-01T00:06:33Z,2023-07-06T17:21:02Z,8,5,MERGED
perseus,Refresh design of image caption,https://github.com/Khan/perseus/pull/693,2023-08-25T18:02:43Z,2023-09-05T17:51:34Z,13,13,MERGED
perseus,Shift capital letters to better align with other buttons,https://github.com/Khan/perseus/pull/671,2023-08-16T13:41:46Z,2023-08-16T16:21:20Z,5,1,MERGED
perseus,Add all alphabet icons,https://github.com/Khan/perseus/pull/669,2023-08-15T19:21:46Z,2023-08-15T20:23:53Z,6,2,MERGED
perseus,Add Fraction Keypad View,https://github.com/Khan/perseus/pull/667,2023-08-15T16:05:13Z,2023-08-17T18:38:44Z,14,16,MERGED
perseus,Fix image loading in the image editor,https://github.com/Khan/perseus/pull/647,2023-08-04T16:51:44Z,2023-08-04T17:07:35Z,8,5,MERGED
perseus,Provide each package's version on load,https://github.com/Khan/perseus/pull/745,2023-09-27T23:39:18Z,2023-10-04T20:14:43Z,14,21,MERGED
perseus,FEI-5160: Publish Storybook to Chromatic for each PR,https://github.com/Khan/perseus/pull/739,2023-09-22T15:42:05Z,2023-09-25T19:20:17Z,5,3,MERGED
perseus,Exclude stories and test files from coverage Codecov reporting,https://github.com/Khan/perseus/pull/736,2023-09-21T21:27:53Z,2023-09-21T22:55:01Z,6,5,MERGED
perseus,Add Codecov badge that shows current status and links to global coverage report of the repo,https://github.com/Khan/perseus/pull/734,2023-09-21T16:38:05Z,2023-09-21T21:22:27Z,5,2,MERGED
perseus,[math-input] Organize storybook stories,https://github.com/Khan/perseus/pull/720,2023-09-12T00:03:11Z,2023-09-25T22:26:27Z,6,3,MERGED
perseus,Fix problems in image widget's caption,https://github.com/Khan/perseus/pull/715,2023-09-10T16:31:17Z,2023-09-11T16:09:03Z,8,3,MERGED
perseus,Test Coveralls hanging indefinitely fix,https://github.com/Khan/perseus/pull/712,2023-09-08T15:50:53Z,2023-09-11T16:15:31Z,4,4,MERGED
perseus,Fix overflow in the y direction on radio choice,https://github.com/Khan/perseus/pull/706,2023-09-07T17:54:00Z,2023-09-07T19:03:36Z,5,7,MERGED
perseus,Fix interactive graph text overlap,https://github.com/Khan/perseus/pull/773,2023-10-20T01:41:57Z,2023-10-20T18:00:21Z,6,1,MERGED
perseus,Add label-image stories to see the widget in action,https://github.com/Khan/perseus/pull/772,2023-10-19T20:22:18Z,2023-10-25T18:53:35Z,3,1,MERGED
perseus,Two column support in Perseus,https://github.com/Khan/perseus/pull/766,2023-10-16T18:52:59Z,2023-12-04T19:45:33Z,3,7,CLOSED
perseus,Fixup image caption overlap on mobile,https://github.com/Khan/perseus/pull/765,2023-10-16T01:30:42Z,2023-10-18T18:37:30Z,5,3,MERGED
perseus,Fix dark typography on mobile view,https://github.com/Khan/perseus/pull/828,2023-11-30T15:48:59Z,2023-11-30T17:55:15Z,6,3,MERGED
perseus,Pill color for correct & incorrect answers,https://github.com/Khan/perseus/pull/824,2023-11-29T15:35:32Z,2023-11-29T21:21:18Z,5,4,MERGED
perseus,"For wide images, label image popovers go above or below markers to lessen chances of covering markers",https://github.com/Khan/perseus/pull/823,2023-11-28T22:51:03Z,2023-11-29T14:09:43Z,5,2,MERGED
perseus,In label image content editor add preferred direction,https://github.com/Khan/perseus/pull/818,2023-11-27T03:50:55Z,2023-12-01T21:40:17Z,5,3,MERGED
perseus,Change KaTeXErrorView to TeXErrorView and use PhosphorIcons,https://github.com/Khan/perseus/pull/814,2023-11-24T16:24:04Z,2023-12-04T17:41:26Z,9,21,MERGED
perseus,[Storybook] Fix styles in editor stories,https://github.com/Khan/perseus/pull/802,2023-11-15T04:44:28Z,2023-11-15T18:26:31Z,8,9,MERGED
perseus,Conditionally switch decimal separator based on locale,https://github.com/Khan/perseus/pull/800,2023-11-14T17:32:13Z,2023-11-15T15:28:32Z,5,2,MERGED
perseus,Upgrade to latest Storybook (v7.5.3),https://github.com/Khan/perseus/pull/790,2023-11-03T19:09:12Z,2023-11-07T00:50:35Z,5,18,MERGED
perseus,[🔥AUDIT🔥] Move Editor component into its own folder,https://github.com/Khan/perseus/pull/898,2023-12-22T17:56:15Z,2023-12-22T18:22:59Z,3,1,MERGED
perseus,"ImageEditor improvements: Story, tests, refactor",https://github.com/Khan/perseus/pull/895,2023-12-21T20:24:55Z,2024-01-30T18:37:07Z,4,3,MERGED
perseus,Editor-Page storybook story,https://github.com/Khan/perseus/pull/887,2023-12-20T18:33:00Z,2023-12-22T18:18:41Z,4,10,MERGED
perseus,Prevent paragraph class from being added to answer pills,https://github.com/Khan/perseus/pull/873,2023-12-14T05:10:29Z,2023-12-14T19:01:44Z,6,9,MERGED
perseus,Add standin widget for deprecated widgets,https://github.com/Khan/perseus/pull/870,2023-12-13T17:58:16Z,2024-01-08T18:49:49Z,15,15,MERGED
perseus,Make WB label into actual label tag,https://github.com/Khan/perseus/pull/865,2023-12-12T17:35:59Z,2023-12-12T20:14:31Z,4,2,MERGED
perseus,add locale to convertDotToTimes logic,https://github.com/Khan/perseus/pull/863,2023-12-07T22:39:49Z,2023-12-12T19:58:57Z,5,4,MERGED
perseus,Fix padding on correct pill,https://github.com/Khan/perseus/pull/851,2023-12-05T21:41:04Z,2023-12-06T02:20:50Z,4,2,MERGED
perseus,Remove TexButtons,https://github.com/Khan/perseus/pull/838,2023-12-04T22:20:20Z,2023-12-06T15:15:29Z,5,4,MERGED
perseus,Fix pills so they allow for multiline answers,https://github.com/Khan/perseus/pull/940,2024-01-25T21:18:11Z,2024-01-25T22:06:53Z,7,3,MERGED
perseus,Make the Expression widget treat `sen` as equivalent to `sin`,https://github.com/Khan/perseus/pull/921,2024-01-11T22:24:30Z,2024-01-11T23:05:38Z,5,4,MERGED
perseus,Update Perseus' Storybook to use MathJax instead of KaTeX,https://github.com/Khan/perseus/pull/917,2024-01-09T22:34:57Z,2024-01-16T15:07:04Z,4,11,MERGED
perseus,Introduce orderer story that uses images,https://github.com/Khan/perseus/pull/916,2024-01-08T21:57:42Z,2024-01-08T23:45:43Z,4,1,MERGED
perseus,Change table zebra-stripe color to Wonder Blocks offWhite,https://github.com/Khan/perseus/pull/908,2024-01-03T23:43:44Z,2024-01-04T17:33:47Z,5,3,MERGED
perseus,Update widget display names to better match their type names,https://github.com/Khan/perseus/pull/907,2024-01-03T23:32:41Z,2024-01-05T20:49:08Z,4,3,MERGED
perseus,Allow entire line segments to be moved by dragging their midpoints,https://github.com/Khan/perseus/pull/1047,2024-02-29T23:24:51Z,2024-03-04T21:52:17Z,9,31,MERGED
perseus,Add instructions to the flipbook UI,https://github.com/Khan/perseus/pull/1034,2024-02-27T22:27:54Z,2024-02-27T23:41:23Z,4,1,MERGED
perseus,Mafs graph foundation with segment,https://github.com/Khan/perseus/pull/1023,2024-02-24T00:35:54Z,2024-02-29T15:00:48Z,20,15,MERGED
perseus,Add stories for GraphSettings and InteractiveGraphEditor,https://github.com/Khan/perseus/pull/1022,2024-02-23T21:55:11Z,2024-02-27T04:32:54Z,7,4,MERGED
perseus,"Add an interactive graph ""flipbook"" to preview questions",https://github.com/Khan/perseus/pull/1017,2024-02-23T00:04:14Z,2024-02-26T16:46:56Z,4,15,MERGED
perseus,Use vite for Storybook,https://github.com/Khan/perseus/pull/1012,2024-02-21T19:10:23Z,2024-02-27T18:59:29Z,12,14,MERGED
perseus,Update ArticleRenderer to split sections into paragraphs in JIPT context,https://github.com/Khan/perseus/pull/1005,2024-02-16T18:33:45Z,2024-02-26T21:03:52Z,6,3,MERGED
perseus,Allow movable points to be selected with the tab key,https://github.com/Khan/perseus/pull/1003,2024-02-15T19:24:31Z,2024-02-26T19:19:52Z,7,8,CLOSED
perseus,Set Expression widget's `accessible` field to true.,https://github.com/Khan/perseus/pull/1001,2024-02-15T01:27:20Z,2024-02-15T19:22:46Z,7,1,MERGED
perseus,Parse markdown list when rendering in JIPT context,https://github.com/Khan/perseus/pull/996,2024-02-14T18:11:19Z,2024-02-26T20:57:36Z,7,1,MERGED
perseus,Add python-program widget and editor,https://github.com/Khan/perseus/pull/989,2024-02-09T22:28:32Z,2024-02-13T23:21:40Z,19,7,MERGED
perseus,Add more graph types to the dev UI,https://github.com/Khan/perseus/pull/988,2024-02-09T22:00:51Z,2024-02-12T17:37:32Z,6,5,MERGED
perseus,Add a Vite-based dev UI for interactive graphs,https://github.com/Khan/perseus/pull/981,2024-02-08T22:04:39Z,2024-02-09T17:30:06Z,8,12,MERGED
perseus,Ensure we do yarn install before Khan/changeset-per-package,https://github.com/Khan/perseus/pull/976,2024-02-08T01:10:12Z,2024-02-09T00:50:56Z,5,2,CLOSED
perseus,"LC-1706: Replace MathQuill's ""Math Input"" label with translated string",https://github.com/Khan/perseus/pull/957,2024-02-01T23:16:14Z,2024-02-02T15:53:47Z,4,2,MERGED
perseus,Add arrows to graph grid,https://github.com/Khan/perseus/pull/1137,2024-03-29T16:53:47Z,2024-04-01T20:07:46Z,10,12,MERGED
perseus,Adjust Explanation Widget to Handle Lots of Text in its Button,https://github.com/Khan/perseus/pull/1131,2024-03-27T19:59:56Z,2024-04-01T21:06:23Z,6,5,MERGED
perseus,Polygon graph: how right angle whether `showAngles` is true or not,https://github.com/Khan/perseus/pull/1119,2024-03-22T20:43:15Z,2024-03-25T15:06:37Z,6,2,MERGED
perseus,Fix aspect ratio for Mafs graphs with nonsquare bounds,https://github.com/Khan/perseus/pull/1114,2024-03-21T19:26:04Z,2024-03-22T23:18:44Z,4,2,MERGED
perseus,Storybook - Organize Categories,https://github.com/Khan/perseus/pull/1113,2024-03-21T16:11:29Z,2024-03-25T19:34:37Z,3,5,MERGED
perseus,Spike: we can render TeX labels with MathJax CHTML,https://github.com/Khan/perseus/pull/1107,2024-03-20T21:30:43Z,2024-03-20T23:31:58Z,6,2,CLOSED
perseus,Migrate ViewportResizer and DeviceFramer to functional components,https://github.com/Khan/perseus/pull/1104,2024-03-20T19:39:14Z,2024-03-22T01:08:04Z,6,6,MERGED
perseus,Image widgets: Centre everywhere except hints,https://github.com/Khan/perseus/pull/1103,2024-03-20T18:54:41Z,2024-04-25T19:24:52Z,10,9,MERGED
perseus,Get the interactive graph flipbook ready for QE testing,https://github.com/Khan/perseus/pull/1100,2024-03-20T16:45:29Z,2024-03-20T19:11:43Z,6,10,MERGED
perseus,Implement adjusting colors for locked points,https://github.com/Khan/perseus/pull/1077,2024-03-14T22:04:35Z,2024-03-18T18:29:28Z,6,7,MERGED
perseus,Make Mafs line segment color offBlack64,https://github.com/Khan/perseus/pull/1073,2024-03-13T23:26:34Z,2024-03-14T18:40:07Z,12,5,MERGED
perseus,Enable inlay hints for VSCode,https://github.com/Khan/perseus/pull/1070,2024-03-13T18:59:45Z,2024-03-14T17:56:26Z,4,2,MERGED
perseus,View a locked point with mafs,https://github.com/Khan/perseus/pull/1067,2024-03-12T23:03:09Z,2024-03-13T21:14:27Z,12,13,MERGED
perseus,Dev Tooling: Better mobile support,https://github.com/Khan/perseus/pull/1066,2024-03-12T22:41:20Z,2024-03-13T00:26:39Z,8,5,MERGED
perseus,Use Wonder Blocks in InteractiveGraphEditor,https://github.com/Khan/perseus/pull/1049,2024-03-01T21:11:36Z,2024-03-12T20:24:56Z,18,12,MERGED
perseus,Create LockedFigureSettingsAccordion component to reduce redundancy,https://github.com/Khan/perseus/pull/1232,2024-04-27T00:35:49Z,2024-05-06T18:16:38Z,5,3,MERGED
perseus,Update spacing in locked figure settings,https://github.com/Khan/perseus/pull/1231,2024-04-27T00:03:59Z,2024-05-06T18:04:08Z,6,2,MERGED
perseus,Show Arrowheads on Locked Lines,https://github.com/Khan/perseus/pull/1229,2024-04-26T20:00:58Z,2024-05-07T16:51:48Z,13,15,MERGED
perseus,Upgrade to Mafs 0.18.5 (includes consistent dash styles for lines),https://github.com/Khan/perseus/pull/1223,2024-04-25T20:06:11Z,2024-04-25T21:29:13Z,3,2,MERGED
perseus,[Dev UI] Display info about background image of current question,https://github.com/Khan/perseus/pull/1222,2024-04-25T19:55:11Z,2024-05-06T21:07:14Z,6,8,MERGED
perseus,[Dev UI] Display correctness in WB Banner,https://github.com/Khan/perseus/pull/1221,2024-04-25T19:44:30Z,2024-04-29T16:00:30Z,6,6,MERGED
perseus,[Dev UI] Wrap flipbook navigation controls in Toolbar,https://github.com/Khan/perseus/pull/1220,2024-04-25T19:37:19Z,2024-04-26T22:08:01Z,4,3,MERGED
perseus,Move delete button in locked figure settings,https://github.com/Khan/perseus/pull/1219,2024-04-25T17:53:46Z,2024-04-25T19:07:11Z,5,2,MERGED
perseus,Use WB Tooltip in InfoTip,https://github.com/Khan/perseus/pull/1218,2024-04-24T23:51:00Z,2024-04-25T17:16:00Z,4,1,MERGED
perseus,Limit colorset for locked figures,https://github.com/Khan/perseus/pull/1210,2024-04-24T17:40:34Z,2024-04-26T21:01:58Z,11,11,MERGED
perseus,Implement locked rays in Interactive Graph,https://github.com/Khan/perseus/pull/1208,2024-04-24T01:27:23Z,2024-04-25T20:14:42Z,12,7,MERGED
perseus,Ensure there's enough contrast on the grid axis lines ,https://github.com/Khan/perseus/pull/1199,2024-04-22T22:28:41Z,2024-05-22T21:23:04Z,5,4,CLOSED
perseus,Use MathJax colors in locked figures UI,https://github.com/Khan/perseus/pull/1195,2024-04-22T17:48:14Z,2024-04-23T00:22:11Z,5,28,MERGED
perseus,Add axis labels to Mafs graphs,https://github.com/Khan/perseus/pull/1193,2024-04-19T21:40:56Z,2024-04-25T17:31:52Z,26,53,MERGED
perseus,Don't extend graphed lines all the way to the graph bounds,https://github.com/Khan/perseus/pull/1187,2024-04-18T17:09:19Z,2024-04-24T23:21:35Z,4,6,MERGED
perseus,Add locked line,https://github.com/Khan/perseus/pull/1186,2024-04-17T23:38:21Z,2024-04-23T00:01:50Z,7,30,MERGED
perseus,New logic to handle bug regarding overlapping axis tick labels in Interactive Graph.,https://github.com/Khan/perseus/pull/1183,2024-04-17T17:58:36Z,2024-04-18T16:03:28Z,8,7,MERGED
perseus,View a locked line,https://github.com/Khan/perseus/pull/1182,2024-04-17T17:21:50Z,2024-04-22T21:30:44Z,13,23,MERGED
perseus,Update locked points in preparation for locked lines,https://github.com/Khan/perseus/pull/1177,2024-04-16T23:09:43Z,2024-04-18T18:41:42Z,13,10,MERGED
perseus,Style the arrowheads on Mafs linear graphs,https://github.com/Khan/perseus/pull/1176,2024-04-16T22:53:17Z,2024-04-17T21:32:42Z,12,6,MERGED
