repo_name,pr_title,pr_url,created_at,closed_at,total_comments,total_commits,state
kaizen-design-system,Fix code block styles,https://github.com/cultureamp/kaizen-design-system/pull/19,2019-09-23T06:38:56Z,2019-09-23T07:11:43Z,0,7,MERGED
kaizen-design-system,feat: Auto generate anchors for headings,https://github.com/cultureamp/kaizen-design-system/pull/103,2019-10-31T07:10:53Z,2019-12-06T04:42:58Z,10,2,MERGED
kaizen-design-system,docs: Figma embeds for guidelines,https://github.com/cultureamp/kaizen-design-system/pull/101,2019-10-31T04:51:34Z,2019-11-01T00:29:59Z,0,10,MERGED
kaizen-design-system,feat: Add restore icon,https://github.com/cultureamp/kaizen-design-system/pull/97,2019-10-31T00:59:36Z,2019-10-31T01:19:08Z,2,1,MERGED
kaizen-design-system,fix: fix visibility of Elm Select's selected item text,https://github.com/cultureamp/kaizen-design-system/pull/95,2019-10-30T23:15:40Z,2019-10-30T23:27:06Z,0,1,MERGED
kaizen-design-system,feat: Add a React version of the Select component,https://github.com/cultureamp/kaizen-design-system/pull/85,2019-10-25T05:10:24Z,2019-10-28T22:44:27Z,4,9,MERGED
kaizen-design-system,docs: Add Storybook demos for components,https://github.com/cultureamp/kaizen-design-system/pull/84,2019-10-25T03:58:34Z,2019-10-31T05:49:45Z,3,8,MERGED
kaizen-design-system,feat: Minor enhancements to the Table component,https://github.com/cultureamp/kaizen-design-system/pull/74,2019-10-23T04:41:20Z,2019-10-31T01:39:26Z,3,5,MERGED
kaizen-design-system,feat: Create SplitButton component,https://github.com/cultureamp/kaizen-design-system/pull/73,2019-10-23T04:08:23Z,2019-10-31T00:40:58Z,5,6,MERGED
kaizen-design-system,docs: Create dos and don'ts components,https://github.com/cultureamp/kaizen-design-system/pull/72,2019-10-23T01:59:58Z,2019-10-25T01:04:45Z,1,5,MERGED
kaizen-design-system,docs: Add empty state image to page header,https://github.com/cultureamp/kaizen-design-system/pull/41,2019-10-14T06:20:53Z,2019-10-14T06:30:08Z,0,2,MERGED
kaizen-design-system,fix: Limit sticky TitleBlock to tablet and up to work better with NavigationBar hamburger menu,https://github.com/cultureamp/kaizen-design-system/pull/137,2019-11-21T06:19:01Z,2019-11-26T00:28:58Z,0,2,MERGED
kaizen-design-system,feat: Add 'cautionary' confirmation modal,https://github.com/cultureamp/kaizen-design-system/pull/135,2019-11-21T03:38:12Z,2019-11-22T00:13:01Z,4,8,MERGED
kaizen-design-system,fix: Ensure that sticky TitleBlock's navigation bar gets a background when scrolling,https://github.com/cultureamp/kaizen-design-system/pull/134,2019-11-21T00:18:38Z,2019-11-21T03:24:11Z,0,3,MERGED
kaizen-design-system,docs: Add Figma embeds to every page,https://github.com/cultureamp/kaizen-design-system/pull/126,2019-11-15T07:31:34Z,2019-11-20T01:35:41Z,0,32,MERGED
kaizen-design-system,fix: Fix Tag not constraining its width to its content,https://github.com/cultureamp/kaizen-design-system/pull/121,2019-11-13T02:38:53Z,2019-11-13T02:58:16Z,0,1,MERGED
kaizen-design-system,docs: add guidance for adding new icons,https://github.com/cultureamp/kaizen-design-system/pull/114,2019-11-07T22:59:34Z,2019-11-07T23:26:32Z,0,1,MERGED
kaizen-design-system,fix: Fix shifting text when expanding and collapsing table rows,https://github.com/cultureamp/kaizen-design-system/pull/110,2019-11-06T00:29:16Z,2019-11-06T04:59:14Z,0,2,MERGED
kaizen-design-system,docs: improve visibility of unbuilt components,https://github.com/cultureamp/kaizen-design-system/pull/196,2019-12-31T05:45:07Z,2020-01-01T22:46:53Z,0,3,MERGED
kaizen-design-system,feat: component library zen colors uplift,https://github.com/cultureamp/kaizen-design-system/pull/194,2019-12-30T02:05:21Z,2020-01-16T01:08:49Z,12,33,MERGED
kaizen-design-system,docs: Fix styles for inline code on Kaizen Site,https://github.com/cultureamp/kaizen-design-system/pull/187,2019-12-24T03:11:22Z,2019-12-24T05:37:07Z,0,2,MERGED
kaizen-design-system,feat: Create loading Collapsible components,https://github.com/cultureamp/kaizen-design-system/pull/183,2019-12-19T22:41:55Z,2020-01-02T04:16:01Z,6,9,CLOSED
kaizen-design-system,feat: Add `boxOffset` property to the `Popover` component,https://github.com/cultureamp/kaizen-design-system/pull/181,2019-12-19T02:21:51Z,2019-12-19T05:09:20Z,2,9,MERGED
kaizen-design-system,docs: Add file upload guidelines,https://github.com/cultureamp/kaizen-design-system/pull/180,2019-12-19T01:01:25Z,2019-12-24T00:16:51Z,0,5,MERGED
kaizen-design-system,fix: Disable fastclick so mobile devices don't require double click,https://github.com/cultureamp/kaizen-design-system/pull/178,2019-12-18T23:44:36Z,2019-12-19T00:25:28Z,1,3,MERGED
kaizen-design-system,feat: add noBottomMargin prop to inlineNotification,https://github.com/cultureamp/kaizen-design-system/pull/161,2019-12-13T04:35:26Z,2019-12-15T23:59:28Z,3,1,MERGED
kaizen-design-system,docs: Add Pagination and Infinite Scroll documentation,https://github.com/cultureamp/kaizen-design-system/pull/156,2019-12-11T01:41:47Z,2019-12-12T01:07:59Z,4,4,MERGED
kaizen-design-system,feat: Update Kaizen Site to use Zen palette,https://github.com/cultureamp/kaizen-design-system/pull/151,2019-12-06T06:52:30Z,2019-12-10T05:47:40Z,1,3,MERGED
kaizen-design-system,feat: Update color docs with Zen palette,https://github.com/cultureamp/kaizen-design-system/pull/150,2019-12-06T06:06:20Z,2019-12-10T05:21:01Z,3,9,MERGED
kaizen-design-system,feat: Added types to colours ,https://github.com/cultureamp/kaizen-design-system/pull/149,2019-12-06T04:00:13Z,2020-01-31T03:38:11Z,4,12,MERGED
kaizen-design-system,fix: Add scaffolding to the React Tooltip Story to make it work,https://github.com/cultureamp/kaizen-design-system/pull/148,2019-12-06T03:50:51Z,2019-12-11T05:00:48Z,0,3,MERGED
kaizen-design-system,"feat: Add elm modal positive, negative variants",https://github.com/cultureamp/kaizen-design-system/pull/250,2020-01-30T03:53:32Z,2020-01-30T07:51:27Z,2,2,MERGED
kaizen-design-system,feat: Make right/left arrows look like forward/backward,https://github.com/cultureamp/kaizen-design-system/pull/246,2020-01-28T00:55:45Z,2020-01-30T04:10:04Z,1,2,MERGED
kaizen-design-system,docs: add date picker documentation,https://github.com/cultureamp/kaizen-design-system/pull/240,2020-01-22T00:22:01Z,2020-02-03T21:28:12Z,2,3,MERGED
kaizen-design-system,fix: Fix elm styling regression for the Popover component,https://github.com/cultureamp/kaizen-design-system/pull/226,2020-01-16T04:20:03Z,2020-01-16T05:24:18Z,2,5,MERGED
kaizen-design-system,feat: Add AsyncSelect component,https://github.com/cultureamp/kaizen-design-system/pull/221,2020-01-14T15:18:07Z,2020-01-15T14:13:12Z,0,3,MERGED
kaizen-design-system,feat: Add ability to specify if elm popover has variable height and apply relevant styles,https://github.com/cultureamp/kaizen-design-system/pull/219,2020-01-14T03:04:17Z,2020-01-15T00:12:21Z,7,1,CLOSED
kaizen-design-system,fix: IE11 fixes for HeroCard,https://github.com/cultureamp/kaizen-design-system/pull/211,2020-01-10T02:41:38Z,2020-01-10T02:46:30Z,0,1,MERGED
kaizen-design-system,feat: Chromatic QA integration (with Github Action),https://github.com/cultureamp/kaizen-design-system/pull/209,2020-01-08T05:58:33Z,2020-01-17T00:52:00Z,6,5,CLOSED
kaizen-design-system,feat: Remove header divider if no heading prop is provided,https://github.com/cultureamp/kaizen-design-system/pull/208,2020-01-07T16:50:13Z,2020-01-09T09:28:25Z,0,2,MERGED
kaizen-design-system,fix: TableRowCell style to make it work on IE11,https://github.com/cultureamp/kaizen-design-system/pull/197,2020-01-02T18:18:02Z,2020-01-03T15:21:47Z,2,3,CLOSED
kaizen-design-system,fix: Bump design-tokens peer dependency,https://github.com/cultureamp/kaizen-design-system/pull/305,2020-02-26T02:36:55Z,2020-02-26T02:40:07Z,0,1,MERGED
kaizen-design-system,fix: Use correct import path for hosted-assets sass file in fonts,https://github.com/cultureamp/kaizen-design-system/pull/303,2020-02-25T04:35:06Z,2020-02-25T06:29:58Z,0,1,MERGED
kaizen-design-system,feat: Uplift Empty State with Greycliff headings,https://github.com/cultureamp/kaizen-design-system/pull/302,2020-02-24T07:10:50Z,2020-03-03T00:07:34Z,1,6,MERGED
kaizen-design-system,feat: Uplift Title Block heading to Greycliff,https://github.com/cultureamp/kaizen-design-system/pull/298,2020-02-21T01:31:44Z,2020-03-02T23:56:15Z,3,6,MERGED
kaizen-design-system,feat: Add content colorscheme to NavigationBar,https://github.com/cultureamp/kaizen-design-system/pull/292,2020-02-18T22:59:18Z,2020-02-19T04:17:39Z,0,5,MERGED
kaizen-design-system,feat: data type styles scss mixins,https://github.com/cultureamp/kaizen-design-system/pull/288,2020-02-18T04:54:58Z,2020-02-19T05:42:42Z,1,5,MERGED
kaizen-design-system,feat: Add type styles for data,https://github.com/cultureamp/kaizen-design-system/pull/282,2020-02-17T07:05:59Z,2020-02-18T00:33:12Z,2,2,MERGED
kaizen-design-system,feat: Add Guidance Block draft component,https://github.com/cultureamp/kaizen-design-system/pull/280,2020-02-17T00:57:32Z,2020-03-05T05:37:20Z,14,8,MERGED
kaizen-design-system,fix: Style regression with Table component,https://github.com/cultureamp/kaizen-design-system/pull/265,2020-02-10T04:25:50Z,2020-02-10T05:16:29Z,0,1,MERGED
kaizen-design-system,feat: Add header images to docs pages,https://github.com/cultureamp/kaizen-design-system/pull/259,2020-02-03T03:25:44Z,2020-03-27T00:30:38Z,3,6,MERGED
kaizen-design-system,feat: SplitButton positioning improvements,https://github.com/cultureamp/kaizen-design-system/pull/255,2020-02-02T02:13:00Z,2020-02-04T06:20:03Z,3,8,MERGED
kaizen-design-system,fix: add missing font-family fallbacks to zen heading mixins,https://github.com/cultureamp/kaizen-design-system/pull/357,2020-03-27T03:14:53Z,2020-03-27T05:09:06Z,3,2,MERGED
kaizen-design-system,fix: informative tag icon,https://github.com/cultureamp/kaizen-design-system/pull/356,2020-03-27T01:06:47Z,2020-04-06T00:41:33Z,1,4,MERGED
kaizen-design-system,fix: title block breadcrumb z index,https://github.com/cultureamp/kaizen-design-system/pull/355,2020-03-26T23:02:15Z,2020-04-14T00:34:58Z,3,3,MERGED
kaizen-design-system,feat: add disabled confirmButton feature to elm modal,https://github.com/cultureamp/kaizen-design-system/pull/352,2020-03-25T01:19:23Z,2020-03-25T03:27:23Z,6,1,MERGED
kaizen-design-system,docs: Using the Docs Addon to generate better stories,https://github.com/cultureamp/kaizen-design-system/pull/348,2020-03-23T02:54:01Z,2020-03-24T22:31:07Z,5,14,MERGED
kaizen-design-system,feat: Create Language page,https://github.com/cultureamp/kaizen-design-system/pull/347,2020-03-23T02:09:27Z,2020-04-02T02:03:07Z,2,6,MERGED
kaizen-design-system,fix: Add padding in dropdown,https://github.com/cultureamp/kaizen-design-system/pull/339,2020-03-19T00:22:30Z,2020-03-19T23:00:19Z,1,9,MERGED
kaizen-design-system,fix: Remove text margin in the button,https://github.com/cultureamp/kaizen-design-system/pull/338,2020-03-19T00:03:18Z,2020-03-19T03:09:38Z,3,8,MERGED
kaizen-design-system,docs: Add note on yarn errors,https://github.com/cultureamp/kaizen-design-system/pull/334,2020-03-18T04:04:16Z,2020-03-24T07:30:04Z,0,4,MERGED
kaizen-design-system,docs: update Icon Button README,https://github.com/cultureamp/kaizen-design-system/pull/330,2020-03-17T23:29:15Z,2020-03-18T03:43:20Z,1,1,MERGED
kaizen-design-system,feat: Add max-width to Paragraph styles,https://github.com/cultureamp/kaizen-design-system/pull/329,2020-03-17T02:14:52Z,2020-03-19T00:09:54Z,11,1,CLOSED
kaizen-design-system,chore(deps): Updated lock file to remove vulnerable dependencies,https://github.com/cultureamp/kaizen-design-system/pull/328,2020-03-16T05:16:33Z,2020-03-16T05:25:06Z,0,1,MERGED
kaizen-design-system,docs: uplift kaizen site headings,https://github.com/cultureamp/kaizen-design-system/pull/327,2020-03-16T02:36:23Z,2020-03-18T05:50:23Z,6,11,MERGED
kaizen-design-system,fix: remove top and bottom padding on the icon to make the block shorter,https://github.com/cultureamp/kaizen-design-system/pull/322,2020-03-12T02:17:00Z,2020-03-16T07:03:10Z,3,5,MERGED
kaizen-design-system,fix: Fix Title Block color bug,https://github.com/cultureamp/kaizen-design-system/pull/319,2020-03-11T02:09:14Z,2020-03-11T02:12:29Z,0,2,MERGED
kaizen-design-system,feat: Uplift Modal typography,https://github.com/cultureamp/kaizen-design-system/pull/315,2020-03-05T03:13:09Z,2020-03-10T02:03:41Z,2,7,MERGED
kaizen-design-system,feat: use zen css styling for Elm Empty State by default,https://github.com/cultureamp/kaizen-design-system/pull/311,2020-03-03T02:28:58Z,2020-03-03T03:17:40Z,0,1,MERGED
kaizen-design-system,ci: make chromatic build optional,https://github.com/cultureamp/kaizen-design-system/pull/440,2020-04-30T06:00:31Z,2020-04-30T23:34:17Z,0,3,MERGED
kaizen-design-system,feat: Panel component ,https://github.com/cultureamp/kaizen-design-system/pull/436,2020-04-29T06:46:27Z,2020-07-09T03:34:23Z,1,8,CLOSED
kaizen-design-system,docs: update Pagination Figma embed,https://github.com/cultureamp/kaizen-design-system/pull/433,2020-04-29T05:43:57Z,2020-05-01T05:00:48Z,0,3,MERGED
kaizen-design-system,fix: update caButtonContainer display type to avoid IE11 issue,https://github.com/cultureamp/kaizen-design-system/pull/401,2020-04-20T16:22:00Z,2020-04-21T13:54:52Z,3,4,MERGED
kaizen-design-system,feat: Tweak the vertical centering of the Tab component,https://github.com/cultureamp/kaizen-design-system/pull/397,2020-04-20T05:19:14Z,2020-04-20T05:33:11Z,0,1,MERGED
kaizen-design-system,(WIP draft) Add Data component,https://github.com/cultureamp/kaizen-design-system/pull/372,2020-04-05T08:27:28Z,2021-09-16T07:34:38Z,5,6,CLOSED
kaizen-design-system,fix: Adjust active link color for content colorscheme,https://github.com/cultureamp/kaizen-design-system/pull/370,2020-04-03T02:43:03Z,2020-04-05T23:13:12Z,0,1,MERGED
kaizen-design-system,feat: Create TextArea & TextAreaField components,https://github.com/cultureamp/kaizen-design-system/pull/368,2020-04-02T07:11:48Z,2020-04-06T06:47:50Z,1,8,MERGED
kaizen-design-system,feat: Add color support to Paragraph component,https://github.com/cultureamp/kaizen-design-system/pull/367,2020-04-02T06:54:56Z,2020-04-03T01:33:03Z,0,4,MERGED
kaizen-design-system,feat: Update content colorscheme for NavigationBar component,https://github.com/cultureamp/kaizen-design-system/pull/364,2020-04-01T04:53:48Z,2020-04-01T23:52:27Z,0,5,MERGED
kaizen-design-system,feat: Change Coral 500 hex value,https://github.com/cultureamp/kaizen-design-system/pull/514,2020-05-27T03:09:59Z,2020-05-27T03:49:01Z,0,1,MERGED
kaizen-design-system,feat: Add tokens for button type styles,https://github.com/cultureamp/kaizen-design-system/pull/512,2020-05-26T07:30:25Z,2020-05-26T08:17:28Z,0,3,MERGED
kaizen-design-system,feat: navigation bar spacing alterations,https://github.com/cultureamp/kaizen-design-system/pull/508,2020-05-22T05:25:20Z,2020-05-25T00:13:19Z,1,5,MERGED
kaizen-design-system,fix: Conditionally dispatch port for Multi Select variant,https://github.com/cultureamp/kaizen-design-system/pull/499,2020-05-19T12:20:22Z,2020-05-21T04:06:36Z,0,1,MERGED
kaizen-design-system,feat: Switch to dart-sass,https://github.com/cultureamp/kaizen-design-system/pull/496,2020-05-19T03:15:10Z,2021-09-16T07:34:34Z,14,4,CLOSED
kaizen-design-system,feat: navigation responsive overhaul,https://github.com/cultureamp/kaizen-design-system/pull/476,2020-05-12T02:47:20Z,2020-05-13T05:09:14Z,3,11,MERGED
kaizen-design-system,feat: elm draft split button,https://github.com/cultureamp/kaizen-design-system/pull/470,2020-05-08T01:39:24Z,2020-05-11T05:30:30Z,5,7,MERGED
kaizen-design-system,feat: Extend TableHeader API for bg colors + revert box shadow,https://github.com/cultureamp/kaizen-design-system/pull/469,2020-05-07T22:17:41Z,2020-05-08T01:48:34Z,2,6,MERGED
kaizen-design-system,feat: Create ZenNavigationTabs draft component,https://github.com/cultureamp/kaizen-design-system/pull/466,2020-05-07T06:47:52Z,2020-06-05T06:40:18Z,1,6,CLOSED
kaizen-design-system,feat: Create description prop for TextAreaField,https://github.com/cultureamp/kaizen-design-system/pull/464,2020-05-07T04:36:45Z,2020-05-07T06:21:31Z,0,5,MERGED
kaizen-design-system,docs: add content DO and DONT component,https://github.com/cultureamp/kaizen-design-system/pull/461,2020-05-06T08:01:12Z,2020-05-13T04:15:26Z,1,3,MERGED
kaizen-design-system,feat: Create new Button package,https://github.com/cultureamp/kaizen-design-system/pull/460,2020-05-06T07:03:34Z,2020-05-28T07:25:07Z,10,30,MERGED
kaizen-design-system,feat: Copy layout styles to deprecated-helpers pkg,https://github.com/cultureamp/kaizen-design-system/pull/456,2020-05-05T07:44:58Z,2020-05-06T01:19:29Z,0,1,MERGED
kaizen-design-system,feat: [SUP-40] add Elm Table,https://github.com/cultureamp/kaizen-design-system/pull/448,2020-05-04T04:56:21Z,2020-05-05T03:03:57Z,3,4,MERGED
kaizen-design-system,feat: Add two more guidance block variances,https://github.com/cultureamp/kaizen-design-system/pull/446,2020-05-04T03:23:28Z,2020-05-05T03:57:07Z,2,3,MERGED
kaizen-design-system,feat: Hero Panel draft component,https://github.com/cultureamp/kaizen-design-system/pull/445,2020-05-04T01:51:16Z,2020-05-06T23:42:45Z,1,7,MERGED
kaizen-design-system,fix: Remove IconButton opacity styles,https://github.com/cultureamp/kaizen-design-system/pull/600,2020-06-30T05:32:08Z,2020-07-03T00:44:25Z,0,8,MERGED
kaizen-design-system,fix: Add clear button to React Select implementation,https://github.com/cultureamp/kaizen-design-system/pull/595,2020-06-29T11:11:39Z,2020-06-30T01:04:01Z,1,3,MERGED
kaizen-design-system,"feat: @kaizen/draft-filter-drawer (React, new package)",https://github.com/cultureamp/kaizen-design-system/pull/590,2020-06-26T07:27:29Z,2020-07-09T05:12:35Z,4,44,MERGED
kaizen-design-system,feat: update filter icon,https://github.com/cultureamp/kaizen-design-system/pull/588,2020-06-26T07:20:19Z,2020-06-29T01:54:24Z,0,2,MERGED
kaizen-design-system,feat: add colour scheme to navigation bar,https://github.com/cultureamp/kaizen-design-system/pull/583,2020-06-26T01:28:34Z,2020-06-26T02:25:33Z,0,3,MERGED
kaizen-design-system,feat: Create mobile actions component,https://github.com/cultureamp/kaizen-design-system/pull/574,2020-06-24T04:45:43Z,2020-06-24T08:02:46Z,8,8,MERGED
kaizen-design-system,fix: Explicitly set the box-sizing for the checkbox & radio focus ring,https://github.com/cultureamp/kaizen-design-system/pull/572,2020-06-23T04:32:06Z,2020-06-23T05:11:21Z,0,1,MERGED
kaizen-design-system,docs(site): Bump up the all font weights from 300 to 400,https://github.com/cultureamp/kaizen-design-system/pull/571,2020-06-23T00:05:25Z,2020-06-26T00:49:56Z,0,7,MERGED
kaizen-design-system,feat: Create Menu component,https://github.com/cultureamp/kaizen-design-system/pull/557,2020-06-18T03:43:48Z,2020-06-19T03:55:44Z,6,10,MERGED
kaizen-design-system,feat: Secondary Single Select Reversed (React),https://github.com/cultureamp/kaizen-design-system/pull/548,2020-06-17T00:35:12Z,2020-06-30T07:08:02Z,7,21,MERGED
kaizen-design-system,feat: Add focus rings to TextField & TextAreaField + reversed support for TextAreaField,https://github.com/cultureamp/kaizen-design-system/pull/544,2020-06-15T01:46:33Z,2020-06-22T02:10:02Z,1,19,MERGED
kaizen-design-system,docs: Added addon-info plugin to Storybook,https://github.com/cultureamp/kaizen-design-system/pull/539,2020-06-10T06:34:38Z,2020-06-12T01:20:45Z,1,9,MERGED
kaizen-design-system,fix: re-add @kaizen/draft-button Elm stories,https://github.com/cultureamp/kaizen-design-system/pull/536,2020-06-09T07:13:17Z,2020-06-09T23:50:11Z,3,6,MERGED
kaizen-design-system,feat: Create draft TitleBlockZen component,https://github.com/cultureamp/kaizen-design-system/pull/523,2020-06-02T06:26:36Z,2020-06-16T05:52:16Z,19,46,MERGED
kaizen-design-system,fix: Update react select version to fix scroll bug,https://github.com/cultureamp/kaizen-design-system/pull/683,2020-07-30T08:49:32Z,2020-07-30T22:14:53Z,2,1,MERGED
kaizen-design-system,fix: title block explicitly sets color of breadcrumb text,https://github.com/cultureamp/kaizen-design-system/pull/680,2020-07-29T00:55:36Z,2020-07-29T00:59:30Z,0,2,MERGED
kaizen-design-system,ci: Add draft packages directories to react-docgen-typescript-loader (#673),https://github.com/cultureamp/kaizen-design-system/pull/674,2020-07-27T08:14:38Z,2020-07-28T05:59:59Z,1,3,MERGED
kaizen-design-system,feat: Add toggle switch with label after the toggle control,https://github.com/cultureamp/kaizen-design-system/pull/665,2020-07-21T06:30:12Z,2020-08-27T06:12:02Z,4,5,MERGED
kaizen-design-system,feat: Add focus support to the Button components,https://github.com/cultureamp/kaizen-design-system/pull/662,2020-07-20T03:43:30Z,2020-07-31T04:38:45Z,7,10,MERGED
kaizen-design-system,feat: add loading spinner,https://github.com/cultureamp/kaizen-design-system/pull/659,2020-07-17T04:56:44Z,2020-07-17T06:26:12Z,1,12,MERGED
kaizen-design-system,fix: removed other actions header when default action is link,https://github.com/cultureamp/kaizen-design-system/pull/649,2020-07-14T02:05:49Z,2020-07-14T02:10:22Z,0,1,MERGED
kaizen-design-system,docs: update Kaizen Site heading only text layout,https://github.com/cultureamp/kaizen-design-system/pull/644,2020-07-10T03:23:43Z,2020-07-10T03:25:58Z,0,1,MERGED
kaizen-design-system,feat: Add Manager Lab signup illustrations,https://github.com/cultureamp/kaizen-design-system/pull/639,2020-07-09T23:14:26Z,2020-07-10T01:14:05Z,0,2,MERGED
kaizen-design-system,fix: Fix mobile actions menu item bug (WIP),https://github.com/cultureamp/kaizen-design-system/pull/638,2020-07-09T09:10:22Z,2020-07-14T01:22:47Z,0,8,MERGED
kaizen-design-system,feat: add language illustration,https://github.com/cultureamp/kaizen-design-system/pull/637,2020-07-09T08:11:46Z,2020-07-10T00:15:35Z,0,12,MERGED
kaizen-design-system,docs: add demo id to filter drawer docs,https://github.com/cultureamp/kaizen-design-system/pull/636,2020-07-09T07:07:00Z,2020-07-16T06:42:38Z,1,4,MERGED
kaizen-design-system,fix: reversed filter button class was not being applied,https://github.com/cultureamp/kaizen-design-system/pull/634,2020-07-09T05:45:48Z,2020-07-09T07:48:45Z,1,2,MERGED
kaizen-design-system,docs: add favicon to Kaizen Site,https://github.com/cultureamp/kaizen-design-system/pull/633,2020-07-09T04:30:13Z,2020-07-09T05:33:23Z,1,4,MERGED
kaizen-design-system,fix: Fix out-of-date component overview link,https://github.com/cultureamp/kaizen-design-system/pull/629,2020-07-08T00:35:29Z,2020-07-08T00:44:35Z,0,1,MERGED
kaizen-design-system,fix: Fix subtitle and tag bug in Title Block,https://github.com/cultureamp/kaizen-design-system/pull/625,2020-07-07T09:54:13Z,2020-07-08T23:53:51Z,0,9,MERGED
kaizen-design-system,feat: add `id` prop to MenuDropdown and Menu,https://github.com/cultureamp/kaizen-design-system/pull/620,2020-07-06T23:55:08Z,2020-07-07T06:02:55Z,0,4,MERGED
kaizen-design-system,feat: add React default secondary select,https://github.com/cultureamp/kaizen-design-system/pull/615,2020-07-03T07:36:40Z,2020-07-07T02:10:03Z,2,4,MERGED
kaizen-design-system,feat: add dropdownWidth prop to Menu,https://github.com/cultureamp/kaizen-design-system/pull/613,2020-07-03T06:11:31Z,2020-07-05T23:38:34Z,3,3,MERGED
kaizen-design-system,feat: Update React Testing Library to 10.4.3,https://github.com/cultureamp/kaizen-design-system/pull/612,2020-07-03T03:48:31Z,2021-09-16T07:34:31Z,2,1,CLOSED
kaizen-design-system,"fix: Use bool for TitleBlockZen ""primary"" btn prop",https://github.com/cultureamp/kaizen-design-system/pull/611,2020-07-03T02:56:13Z,2020-07-03T03:03:22Z,0,1,MERGED
kaizen-design-system,feat: abillity to add additional content to GenericButton,https://github.com/cultureamp/kaizen-design-system/pull/608,2020-07-02T23:34:33Z,2020-07-08T06:19:13Z,4,7,MERGED
kaizen-design-system,feat: Menu is now left aligned by default,https://github.com/cultureamp/kaizen-design-system/pull/605,2020-07-02T00:25:31Z,2020-07-02T01:34:40Z,1,3,MERGED
kaizen-design-system,fix: Changed box-sizing in tag so the height matches Figma,https://github.com/cultureamp/kaizen-design-system/pull/604,2020-07-01T07:55:08Z,2020-07-02T23:45:24Z,2,13,MERGED
kaizen-design-system,fix: fixes margin when a status tag and page switcher are used together,https://github.com/cultureamp/kaizen-design-system/pull/747,2020-08-31T00:02:21Z,2020-08-31T00:53:33Z,0,1,MERGED
kaizen-design-system,docs: update Progress Stepper page,https://github.com/cultureamp/kaizen-design-system/pull/742,2020-08-28T03:53:23Z,2020-08-28T06:41:05Z,0,4,MERGED
kaizen-design-system,fix: consider icon position end when additional content is used on generic button,https://github.com/cultureamp/kaizen-design-system/pull/741,2020-08-28T03:49:42Z,2020-08-28T04:29:41Z,1,3,MERGED
kaizen-design-system,fix: Change default label position to end,https://github.com/cultureamp/kaizen-design-system/pull/739,2020-08-28T01:17:38Z,2020-08-28T01:47:05Z,1,1,CLOSED
kaizen-design-system,docs: update data viz docs with sparklines,https://github.com/cultureamp/kaizen-design-system/pull/736,2020-08-26T07:59:26Z,2020-08-28T01:19:12Z,1,3,MERGED
kaizen-design-system,feat: Add disabled HierarchicalSelect [PHRI-50],https://github.com/cultureamp/kaizen-design-system/pull/735,2020-08-26T06:55:35Z,2020-08-27T00:05:33Z,0,1,MERGED
kaizen-design-system,fix: title block secondary actions tablet view bugfix,https://github.com/cultureamp/kaizen-design-system/pull/733,2020-08-25T05:35:15Z,2020-08-25T21:26:39Z,0,3,MERGED
kaizen-design-system,feat: Elm SelectField component,https://github.com/cultureamp/kaizen-design-system/pull/731,2020-08-25T02:32:00Z,2020-08-26T01:03:05Z,4,5,MERGED
kaizen-design-system,feat: Add new badge to menu items,https://github.com/cultureamp/kaizen-design-system/pull/729,2020-08-24T08:45:09Z,2020-08-27T01:53:36Z,1,6,MERGED
kaizen-design-system,feat: Add security-tip icon,https://github.com/cultureamp/kaizen-design-system/pull/725,2020-08-24T01:37:18Z,2020-08-24T01:59:43Z,0,1,MERGED
