repo_name,pr_title,pr_url,created_at,closed_at,total_comments,total_commits,state
kaizen-design-system,feat: Hierarchical menu and hierarchical select improvements [PHRI-32],https://github.com/cultureamp/kaizen-design-system/pull/718,2020-08-19T01:43:14Z,2020-08-19T04:05:41Z,4,13,MERGED
kaizen-design-system,feat: added repeats icon,https://github.com/cultureamp/kaizen-design-system/pull/717,2020-08-18T07:33:53Z,2020-08-28T01:39:42Z,0,7,MERGED
kaizen-design-system,feat: Add report switcher to Title Block,https://github.com/cultureamp/kaizen-design-system/pull/716,2020-08-18T06:52:40Z,2020-08-25T03:43:55Z,1,11,MERGED
kaizen-design-system,feat: create Avatar draft component,https://github.com/cultureamp/kaizen-design-system/pull/715,2020-08-18T01:44:21Z,2020-08-19T06:32:03Z,11,18,MERGED
kaizen-design-system,feat: Add data-automation-class to generic notification,https://github.com/cultureamp/kaizen-design-system/pull/704,2020-08-12T00:56:44Z,2020-08-12T04:09:57Z,10,3,MERGED
kaizen-design-system,feat: add textarea for Elm,https://github.com/cultureamp/kaizen-design-system/pull/698,2020-08-06T11:51:35Z,2020-08-07T00:45:05Z,2,2,MERGED
kaizen-design-system,feat: add ability to include a select label,https://github.com/cultureamp/kaizen-design-system/pull/696,2020-08-06T05:12:43Z,2020-10-12T03:11:37Z,3,3,CLOSED
kaizen-design-system,feat: add divider for Elm,https://github.com/cultureamp/kaizen-design-system/pull/688,2020-08-04T05:50:17Z,2020-08-05T01:48:24Z,1,3,MERGED
kaizen-design-system,feat: Add hierarchical menu and hierarchical select components,https://github.com/cultureamp/kaizen-design-system/pull/687,2020-08-04T00:33:02Z,2020-08-18T00:00:14Z,1,47,MERGED
kaizen-design-system,"feat: add positive, negative and neutral delta icons",https://github.com/cultureamp/kaizen-design-system/pull/793,2020-09-25T03:04:30Z,2020-09-28T06:55:34Z,3,3,MERGED
kaizen-design-system,fix: navigation bar design review,https://github.com/cultureamp/kaizen-design-system/pull/787,2020-09-22T03:04:41Z,2020-09-22T03:24:20Z,0,2,MERGED
kaizen-design-system,feat: basic Zen uplift for Select border and hover state,https://github.com/cultureamp/kaizen-design-system/pull/786,2020-09-21T23:04:25Z,2020-09-22T00:44:01Z,1,3,MERGED
kaizen-design-system,feat: SplitButton and Menu updates,https://github.com/cultureamp/kaizen-design-system/pull/785,2020-09-21T06:38:48Z,2020-10-01T04:48:36Z,4,11,MERGED
kaizen-design-system,fix: Apply spacing to labels when inline with form controls,https://github.com/cultureamp/kaizen-design-system/pull/784,2020-09-21T04:28:08Z,2020-09-21T23:33:30Z,1,2,MERGED
kaizen-design-system,fix: admin theme subtitle fix,https://github.com/cultureamp/kaizen-design-system/pull/769,2020-09-08T04:42:03Z,2020-09-08T05:18:22Z,0,2,MERGED
kaizen-design-system,fix: Add explicit rule for underline on nav tabs,https://github.com/cultureamp/kaizen-design-system/pull/768,2020-09-08T03:19:27Z,2020-09-08T03:28:53Z,0,1,MERGED
kaizen-design-system,feat: add animated badge component,https://github.com/cultureamp/kaizen-design-system/pull/762,2020-09-04T03:09:44Z,2020-09-04T03:45:38Z,4,8,MERGED
kaizen-design-system,docs: Improve visibility of deprecated components,https://github.com/cultureamp/kaizen-design-system/pull/749,2020-09-01T03:30:18Z,2020-09-11T07:00:50Z,6,18,MERGED
kaizen-design-system,feat: Add table header wrapping and alignment support,https://github.com/cultureamp/kaizen-design-system/pull/851,2020-10-29T10:14:33Z,2020-11-10T02:45:20Z,3,4,MERGED
kaizen-design-system,"docs: Added the rationale for the working button, changed language to…",https://github.com/cultureamp/kaizen-design-system/pull/840,2020-10-28T02:00:35Z,2020-11-11T03:08:00Z,5,11,MERGED
kaizen-design-system,docs: Added NoMargin wrapper to titleblocks ,https://github.com/cultureamp/kaizen-design-system/pull/838,2020-10-22T06:00:57Z,2020-10-25T23:07:55Z,0,7,MERGED
kaizen-design-system,feat: Allow removal of dismiss button via empty dismissLabel string,https://github.com/cultureamp/kaizen-design-system/pull/831,2020-10-20T23:57:10Z,2020-10-21T00:13:48Z,0,1,CLOSED
kaizen-design-system,ci: Upgrade to Storybook 6,https://github.com/cultureamp/kaizen-design-system/pull/827,2020-10-19T05:56:11Z,2020-10-21T06:42:37Z,4,30,MERGED
kaizen-design-system,feat: TitleBlockZen. Add a  variant for the badge,https://github.com/cultureamp/kaizen-design-system/pull/826,2020-10-16T15:58:04Z,2020-10-20T00:44:48Z,1,7,MERGED
kaizen-design-system,feat: navigation bar improvements,https://github.com/cultureamp/kaizen-design-system/pull/822,2020-10-16T00:30:49Z,2021-05-05T01:33:46Z,2,7,CLOSED
kaizen-design-system,fix: Add style disabled options in <Select>,https://github.com/cultureamp/kaizen-design-system/pull/816,2020-10-13T10:33:06Z,2020-10-13T23:44:18Z,4,1,MERGED
kaizen-design-system,feat: GuidanceBlock Prominent Variant,https://github.com/cultureamp/kaizen-design-system/pull/804,2020-10-01T07:08:55Z,2020-10-07T03:13:03Z,7,6,MERGED
kaizen-design-system,feat: Uplift the table to the new Zen designs ,https://github.com/cultureamp/kaizen-design-system/pull/803,2020-10-01T06:55:16Z,2020-10-09T03:43:47Z,6,16,MERGED
kaizen-design-system,"feat: Add Roadblock modal (React), update confirmation modals to Zen designs",https://github.com/cultureamp/kaizen-design-system/pull/800,2020-10-01T02:48:41Z,2020-10-06T22:40:41Z,7,8,MERGED
kaizen-design-system,feat: Add prominent variant to TextAreaField (React),https://github.com/cultureamp/kaizen-design-system/pull/869,2020-11-26T03:43:21Z,2020-11-26T05:02:43Z,0,4,MERGED
kaizen-design-system,feat: created hover ability for header table row cells,https://github.com/cultureamp/kaizen-design-system/pull/867,2020-11-23T02:06:47Z,2020-11-24T23:52:05Z,0,2,MERGED
kaizen-design-system,feat: Add autogrow feature to TextArea/TextAreaField,https://github.com/cultureamp/kaizen-design-system/pull/866,2020-11-18T06:12:15Z,2020-11-19T00:56:24Z,5,3,MERGED
kaizen-design-system,feat: Add ability to change the table sorting arrow from descending to ascending,https://github.com/cultureamp/kaizen-design-system/pull/864,2020-11-16T03:29:14Z,2020-11-16T23:51:23Z,3,4,MERGED
kaizen-design-system,chore: Fix stylelint warnings for color names,https://github.com/cultureamp/kaizen-design-system/pull/862,2020-11-12T06:54:25Z,2020-11-13T01:06:21Z,0,3,MERGED
kaizen-design-system,fix: Add coverage of .js and .d.ts files to clean scripts that were missing them,https://github.com/cultureamp/kaizen-design-system/pull/861,2020-11-12T06:26:43Z,2020-11-12T23:54:58Z,0,3,MERGED
kaizen-design-system,feat: Add tooltip to the Table header,https://github.com/cultureamp/kaizen-design-system/pull/859,2020-11-11T04:00:48Z,2020-11-11T22:45:08Z,3,7,MERGED
kaizen-design-system,feat: Allow custom icons for popovers,https://github.com/cultureamp/kaizen-design-system/pull/857,2020-11-10T02:39:00Z,2020-11-10T22:24:02Z,1,4,MERGED
kaizen-design-system,feat: adding department icon,https://github.com/cultureamp/kaizen-design-system/pull/855,2020-11-08T23:35:00Z,2020-11-09T00:06:44Z,0,1,MERGED
kaizen-design-system,feat: add department icon,https://github.com/cultureamp/kaizen-design-system/pull/854,2020-11-06T04:22:25Z,2020-11-06T04:23:00Z,1,5,CLOSED
kaizen-design-system,feat: Add 'guidance' as a variant for popovers,https://github.com/cultureamp/kaizen-design-system/pull/853,2020-11-05T00:36:50Z,2020-11-10T02:32:40Z,2,1,CLOSED
kaizen-design-system,"fix: console error, where boolean was passed into `className`",https://github.com/cultureamp/kaizen-design-system/pull/913,2020-12-23T03:38:59Z,2020-12-23T04:11:15Z,0,1,MERGED
kaizen-design-system,fix: Refine filter menu button styling,https://github.com/cultureamp/kaizen-design-system/pull/912,2020-12-22T23:57:31Z,2020-12-23T01:15:19Z,0,2,MERGED
kaizen-design-system,fix: center align close icon in toast notification,https://github.com/cultureamp/kaizen-design-system/pull/903,2020-12-14T06:43:00Z,2020-12-16T02:46:05Z,1,5,MERGED
kaizen-design-system,feat: Add deprecation warning to old title block,https://github.com/cultureamp/kaizen-design-system/pull/902,2020-12-14T05:00:53Z,2020-12-16T04:31:48Z,0,3,MERGED
kaizen-design-system,feat: new FilterMenuButton draft component,https://github.com/cultureamp/kaizen-design-system/pull/893,2020-12-09T02:48:56Z,2020-12-14T02:06:58Z,2,6,MERGED
kaizen-design-system,fix: Don't set TextArea if calculated height is 0,https://github.com/cultureamp/kaizen-design-system/pull/885,2020-12-07T03:21:06Z,2020-12-07T04:14:40Z,0,1,MERGED
kaizen-design-system,feat: Allow for the modal confirmation button to be optional,https://github.com/cultureamp/kaizen-design-system/pull/882,2020-12-03T11:09:35Z,2020-12-04T02:18:26Z,1,3,MERGED
kaizen-design-system,"feat: Tooltip to allow for React.ReactNode, instead of just string",https://github.com/cultureamp/kaizen-design-system/pull/874,2020-12-01T02:33:50Z,2020-12-01T03:41:54Z,0,2,MERGED
kaizen-design-system,feat: Add ability to change the Menu auto hide behaviour,https://github.com/cultureamp/kaizen-design-system/pull/984,2021-01-29T20:11:37Z,2021-02-01T02:21:30Z,3,4,MERGED
kaizen-design-system,feat: Information modal design changes with added support for images and secondary actions,https://github.com/cultureamp/kaizen-design-system/pull/983,2021-01-29T00:50:18Z,2021-02-01T01:29:36Z,2,5,MERGED
kaizen-design-system,chore: add a Github workflow that adds comments to PRs with branch preview links,https://github.com/cultureamp/kaizen-design-system/pull/981,2021-01-28T01:43:10Z,2021-02-01T11:51:37Z,1,2,MERGED
kaizen-design-system,feat: Put rebrand components behind soft feature flag,https://github.com/cultureamp/kaizen-design-system/pull/972,2021-01-22T01:57:46Z,2021-03-23T23:02:19Z,19,32,CLOSED
kaizen-design-system,feat: Slider component,https://github.com/cultureamp/kaizen-design-system/pull/968,2021-01-21T07:32:59Z,2021-01-28T00:16:50Z,3,14,MERGED
kaizen-design-system,feat: implementing search field component,https://github.com/cultureamp/kaizen-design-system/pull/957,2021-01-20T01:19:03Z,2021-01-26T00:06:00Z,0,9,MERGED
kaizen-design-system,feat: Remove cursor css for Tag components,https://github.com/cultureamp/kaizen-design-system/pull/947,2021-01-18T23:50:12Z,2021-01-19T03:20:30Z,0,2,MERGED
kaizen-design-system,feat: Add ability to use 'working' confirm/submit buttons on input/edit and confirmation modals,https://github.com/cultureamp/kaizen-design-system/pull/941,2021-01-18T00:12:34Z,2021-01-18T23:29:16Z,2,3,MERGED
kaizen-design-system,fix: remove the max-width to make the button expand with the metadata,https://github.com/cultureamp/kaizen-design-system/pull/920,2021-01-11T23:44:27Z,2021-01-12T00:18:09Z,0,1,MERGED
kaizen-design-system,"feat: Add automatic positioning for the Menu component, using popper",https://github.com/cultureamp/kaizen-design-system/pull/1110,2021-02-24T05:12:33Z,2021-02-25T14:19:54Z,5,12,MERGED
kaizen-design-system,feat: Add secondary destructive button variant,https://github.com/cultureamp/kaizen-design-system/pull/1109,2021-02-24T04:57:00Z,2021-02-25T02:08:06Z,1,4,MERGED
kaizen-design-system,feat: Update navigation bar to support Heart,https://github.com/cultureamp/kaizen-design-system/pull/1095,2021-02-22T09:28:51Z,2021-02-26T00:39:54Z,7,10,MERGED
kaizen-design-system,feat: Add photo upload icon,https://github.com/cultureamp/kaizen-design-system/pull/1091,2021-02-22T02:33:05Z,2021-02-22T02:38:47Z,1,1,MERGED
kaizen-design-system,feat: align breakpoints to mobile design token to make rollout of new title block and navigation easier,https://github.com/cultureamp/kaizen-design-system/pull/1074,2021-02-18T01:43:17Z,2021-02-18T04:25:04Z,1,4,MERGED
kaizen-design-system,feat: Update titleblock and pageLayout to support Heart,https://github.com/cultureamp/kaizen-design-system/pull/1066,2021-02-17T02:59:43Z,2021-02-22T09:26:05Z,4,19,MERGED
kaizen-design-system,feat: Add portal support to Tooltip,https://github.com/cultureamp/kaizen-design-system/pull/1058,2021-02-16T04:36:04Z,2021-02-18T14:09:50Z,4,6,MERGED
kaizen-design-system,docs: Add UI Kit figma links for specific modal stories,https://github.com/cultureamp/kaizen-design-system/pull/1051,2021-02-15T07:16:30Z,2021-02-22T06:44:09Z,1,2,MERGED
kaizen-design-system,feat: Tooltip positioning improvements + allow it to work inside an `overflow: hidden` element,https://github.com/cultureamp/kaizen-design-system/pull/1041,2021-02-15T01:55:44Z,2021-02-16T03:35:11Z,5,22,MERGED
kaizen-design-system,fix: Fix spacing issues on Menu dropdown,https://github.com/cultureamp/kaizen-design-system/pull/1028,2021-02-10T06:58:26Z,2021-02-11T06:25:47Z,2,4,MERGED
kaizen-design-system,feat: Add ids for menu items and headers,https://github.com/cultureamp/kaizen-design-system/pull/1027,2021-02-10T02:57:48Z,2021-02-10T05:19:01Z,3,1,CLOSED
kaizen-design-system,chore: Remove unused package @kaizen/draft-menu-list,https://github.com/cultureamp/kaizen-design-system/pull/1007,2021-02-07T23:05:53Z,2021-02-07T23:28:22Z,1,1,MERGED
kaizen-design-system,feat: Update button to support Heart,https://github.com/cultureamp/kaizen-design-system/pull/1004,2021-02-05T01:07:46Z,2021-02-09T00:19:54Z,6,10,MERGED
kaizen-design-system,feat: Updated color of shadow to black with opacity,https://github.com/cultureamp/kaizen-design-system/pull/997,2021-02-03T22:59:45Z,2021-02-04T00:01:12Z,2,2,MERGED
kaizen-design-system,feat: Add active state prop to menu items,https://github.com/cultureamp/kaizen-design-system/pull/996,2021-02-03T04:58:32Z,2021-02-03T22:56:12Z,1,2,MERGED
kaizen-design-system,docs: Embed UI Kit Figma designs in Storybook,https://github.com/cultureamp/kaizen-design-system/pull/992,2021-02-01T23:57:38Z,2021-02-05T04:08:44Z,3,5,MERGED
kaizen-design-system,"feat: Fix menu position, when not enough room above the toggle button",https://github.com/cultureamp/kaizen-design-system/pull/987,2021-02-01T00:45:00Z,2021-02-01T04:30:04Z,1,5,MERGED
kaizen-design-system,feat: add mixins to create accessible stripes on colour blocks,https://github.com/cultureamp/kaizen-design-system/pull/1350,2021-03-31T07:41:01Z,2021-09-08T07:34:37Z,5,8,CLOSED
kaizen-design-system,feat: Make the button optional on GuidanceBlock component,https://github.com/cultureamp/kaizen-design-system/pull/1349,2021-03-31T03:19:30Z,2021-04-01T04:14:34Z,1,2,MERGED
kaizen-design-system,feat: add new illustration for survey overview page,https://github.com/cultureamp/kaizen-design-system/pull/1334,2021-03-29T03:20:50Z,2021-03-29T03:38:40Z,1,2,MERGED
kaizen-design-system,feat: add additional background colors to HeroCard component,https://github.com/cultureamp/kaizen-design-system/pull/1320,2021-03-26T00:37:33Z,2021-03-26T03:16:41Z,6,2,MERGED
kaizen-design-system,"fix: bumping tooltip z-index to much higher value, by using layers vars",https://github.com/cultureamp/kaizen-design-system/pull/1312,2021-03-24T00:50:43Z,2021-04-07T00:47:04Z,9,9,MERGED
kaizen-design-system,refactor: Migrate remaining usages of non-variable tokens,https://github.com/cultureamp/kaizen-design-system/pull/1308,2021-03-23T03:22:08Z,2021-04-07T01:21:51Z,13,23,MERGED
kaizen-design-system,fix: Adjust padding and sizing within inline notifications,https://github.com/cultureamp/kaizen-design-system/pull/1280,2021-03-19T05:27:42Z,2021-03-22T01:57:01Z,2,3,MERGED
kaizen-design-system,feat: Update tooltip to heart theme,https://github.com/cultureamp/kaizen-design-system/pull/1255,2021-03-15T07:21:52Z,2021-03-23T00:16:40Z,2,4,MERGED
kaizen-design-system,feat: InformationModal include working button,https://github.com/cultureamp/kaizen-design-system/pull/1243,2021-03-12T16:52:09Z,2021-03-18T01:39:02Z,5,12,MERGED
kaizen-design-system,feat: Add Heart theme support to Well component,https://github.com/cultureamp/kaizen-design-system/pull/1242,2021-03-12T08:15:40Z,2021-03-23T03:25:42Z,1,2,MERGED
kaizen-design-system,fix: Fix styling bugs in TitleBlockZen,https://github.com/cultureamp/kaizen-design-system/pull/1232,2021-03-11T05:42:42Z,2021-03-11T05:59:50Z,2,4,MERGED
kaizen-design-system,docs: Show RGB and HEX values for colors story,https://github.com/cultureamp/kaizen-design-system/pull/1227,2021-03-10T07:15:13Z,2021-03-10T22:40:18Z,3,2,MERGED
kaizen-design-system,"feat: Update Global, Inline and Toast notifications to support Heart",https://github.com/cultureamp/kaizen-design-system/pull/1218,2021-03-09T05:41:29Z,2021-03-22T23:17:44Z,7,15,MERGED
kaizen-design-system,feat: Update Modal to support Heart,https://github.com/cultureamp/kaizen-design-system/pull/1185,2021-03-04T06:21:16Z,2021-03-09T00:03:46Z,3,4,MERGED
kaizen-design-system,feat: Add popper layout engine to `Popover`,https://github.com/cultureamp/kaizen-design-system/pull/1178,2021-03-03T02:40:23Z,2021-03-03T02:48:24Z,1,1,MERGED
kaizen-design-system,feat: Include notification prop to display on Information Modal,https://github.com/cultureamp/kaizen-design-system/pull/1166,2021-03-02T19:55:42Z,2021-03-10T12:55:49Z,4,8,MERGED
kaizen-design-system,docs: Update avatar storybook docs to a static image,https://github.com/cultureamp/kaizen-design-system/pull/1157,2021-03-01T22:20:39Z,2021-03-11T06:28:43Z,1,6,MERGED
kaizen-design-system,feat: Add popper layout engine to `Popover`,https://github.com/cultureamp/kaizen-design-system/pull/1151,2021-03-01T09:03:06Z,2021-03-02T06:23:23Z,13,24,MERGED
kaizen-design-system,"docs: Add Storybook documentation for Heading, Paragraph and Box",https://github.com/cultureamp/kaizen-design-system/pull/1150,2021-03-01T07:24:09Z,2021-11-02T01:50:36Z,4,9,MERGED
kaizen-design-system,feat: Make tiles flexy when used in TileGrid,https://github.com/cultureamp/kaizen-design-system/pull/1518,2021-04-29T06:45:30Z,2021-05-11T02:38:27Z,6,5,MERGED
kaizen-design-system,feat: Improved Heart support for titleblock,https://github.com/cultureamp/kaizen-design-system/pull/1510,2021-04-28T09:25:12Z,2021-05-03T00:30:34Z,1,3,MERGED
kaizen-design-system,fix: remove hidden overflow on collapsible component,https://github.com/cultureamp/kaizen-design-system/pull/1509,2021-04-28T05:16:06Z,2021-04-28T05:20:50Z,1,1,MERGED
kaizen-design-system,chore(deps): bump @babel/core from 7.13.10 to 7.13.16,https://github.com/cultureamp/kaizen-design-system/pull/1502,2021-04-25T14:10:23Z,2021-06-07T04:59:05Z,2,1,CLOSED
kaizen-design-system,feat: Added Heart spot illustrations,https://github.com/cultureamp/kaizen-design-system/pull/1473,2021-04-22T07:43:03Z,2021-04-26T06:00:38Z,1,5,MERGED
kaizen-design-system,docs: Change defaultTheme in website to Heart,https://github.com/cultureamp/kaizen-design-system/pull/1467,2021-04-21T06:19:31Z,2021-04-21T06:58:07Z,1,3,CLOSED
kaizen-design-system,feat: Add get started illustration to storybook and scene component,https://github.com/cultureamp/kaizen-design-system/pull/1464,2021-04-20T04:28:11Z,2021-04-20T04:47:53Z,1,3,MERGED
kaizen-design-system,fix: Stop shadow from overflowing and remove overflow-x:hidden,https://github.com/cultureamp/kaizen-design-system/pull/1451,2021-04-19T03:17:10Z,2021-04-19T03:49:14Z,0,1,MERGED
kaizen-design-system,feat: add disabled variant of Elm Select and SelectField,https://github.com/cultureamp/kaizen-design-system/pull/1431,2021-04-15T05:57:36Z,2021-04-15T23:41:23Z,2,2,MERGED
kaizen-design-system,feat: Add clear variant to Collapsible component,https://github.com/cultureamp/kaizen-design-system/pull/1429,2021-04-15T01:18:37Z,2021-04-15T06:29:16Z,6,3,MERGED
kaizen-design-system,feat: adjust Collapsible component styles and add prop to disable background in header,https://github.com/cultureamp/kaizen-design-system/pull/1426,2021-04-13T03:44:51Z,2021-04-13T05:10:20Z,1,4,MERGED
kaizen-design-system,feat: Add Heart support,https://github.com/cultureamp/kaizen-design-system/pull/1425,2021-04-13T00:56:23Z,2021-04-13T03:56:34Z,1,2,MERGED
kaizen-design-system,feat: Optional max width for Guidance Block,https://github.com/cultureamp/kaizen-design-system/pull/1377,2021-04-07T01:12:09Z,2021-04-08T00:39:11Z,4,3,MERGED
kaizen-design-system,feat: add clearable option for Elm Select,https://github.com/cultureamp/kaizen-design-system/pull/1351,2021-04-01T04:34:23Z,2021-04-07T05:49:54Z,3,2,MERGED
kaizen-design-system,fix: Make GuidanceBlock action buttons right aligned,https://github.com/cultureamp/kaizen-design-system/pull/1621,2021-05-20T04:03:45Z,2021-05-20T04:58:59Z,1,4,MERGED
kaizen-design-system,feat: add wrapping element to illustration,https://github.com/cultureamp/kaizen-design-system/pull/1613,2021-05-18T21:10:41Z,2021-05-21T04:22:25Z,1,2,MERGED
kaizen-design-system,feat: Add 180 versions for performance template library spots,https://github.com/cultureamp/kaizen-design-system/pull/1612,2021-05-18T11:12:13Z,2021-05-19T03:55:23Z,2,3,MERGED
kaizen-design-system,fix: guidance block max-width not centering description text,https://github.com/cultureamp/kaizen-design-system/pull/1610,2021-05-17T22:18:02Z,2021-05-18T05:22:17Z,2,5,MERGED
kaizen-design-system,ci: Add GH workflow for chromatic,https://github.com/cultureamp/kaizen-design-system/pull/1601,2021-05-17T04:01:50Z,2021-11-10T07:34:26Z,28,24,CLOSED
kaizen-design-system,fix: Make box-sizing explicit,https://github.com/cultureamp/kaizen-design-system/pull/1600,2021-05-17T03:01:04Z,2021-05-17T06:45:55Z,1,2,MERGED
kaizen-design-system,fix: Fallback to blank survey for Heart template illustrations without Zen equivalents,https://github.com/cultureamp/kaizen-design-system/pull/1598,2021-05-17T01:56:11Z,2021-05-17T03:54:58Z,1,2,MERGED
kaizen-design-system,fix: Add space between actions on MultiActionTile,https://github.com/cultureamp/kaizen-design-system/pull/1597,2021-05-17T01:12:03Z,2021-05-17T01:42:27Z,1,2,MERGED
kaizen-design-system,feat: add Heart theme option to Elm Modal and EmptyState (for Heart illustrations),https://github.com/cultureamp/kaizen-design-system/pull/1581,2021-05-14T05:33:25Z,2021-06-11T00:19:37Z,4,13,MERGED
kaizen-design-system,feat: Allow actions to open in new tabs,https://github.com/cultureamp/kaizen-design-system/pull/1580,2021-05-14T00:54:27Z,2021-05-14T03:22:45Z,2,1,MERGED
kaizen-design-system,fix: Ensure tiles don't expand to fill width when they’re short of a row,https://github.com/cultureamp/kaizen-design-system/pull/1577,2021-05-14T00:17:11Z,2021-05-14T00:39:55Z,1,1,MERGED
kaizen-design-system,feat: guidance block accepts spot component,https://github.com/cultureamp/kaizen-design-system/pull/1571,2021-05-11T05:29:20Z,2021-05-16T23:05:00Z,9,8,CLOSED
kaizen-design-system,feat: Add data variant for table,https://github.com/cultureamp/kaizen-design-system/pull/1548,2021-05-06T00:19:26Z,2021-05-06T02:06:43Z,1,4,MERGED
kaizen-design-system,fix: use inline-flex for Button to fix edge case,https://github.com/cultureamp/kaizen-design-system/pull/1544,2021-05-05T07:19:59Z,2021-05-05T23:50:35Z,0,3,MERGED
kaizen-design-system,fix: add default variant for badge in button component when button is in reversed,https://github.com/cultureamp/kaizen-design-system/pull/1543,2021-05-05T02:31:49Z,2021-05-05T02:59:19Z,1,3,MERGED
kaizen-design-system,feat: Add tooltip to guidanceblock action,https://github.com/cultureamp/kaizen-design-system/pull/1541,2021-05-05T01:29:57Z,2021-05-13T03:35:14Z,4,20,MERGED
kaizen-design-system,fix: Use 100% height for dismissIcon on Tag to avoid global box-sizing css conflicts,https://github.com/cultureamp/kaizen-design-system/pull/1531,2021-05-03T23:40:03Z,2021-05-04T02:44:18Z,8,3,MERGED
kaizen-design-system,feat: add reversed table header styling,https://github.com/cultureamp/kaizen-design-system/pull/1528,2021-05-03T04:57:06Z,2021-05-03T06:55:42Z,1,3,MERGED
kaizen-design-system,fix: border radius on collapsible component,https://github.com/cultureamp/kaizen-design-system/pull/1526,2021-05-03T03:12:34Z,2021-05-04T23:42:43Z,3,17,MERGED
kaizen-design-system,feat: Add Pagination component,https://github.com/cultureamp/kaizen-design-system/pull/1733,2021-06-29T07:05:46Z,2021-10-26T00:28:50Z,31,36,MERGED
kaizen-design-system,ci: Fix clean scripts in design-tokens and stylelint-plugin,https://github.com/cultureamp/kaizen-design-system/pull/1732,2021-06-29T03:20:05Z,2021-07-02T01:05:26Z,4,3,MERGED
kaizen-design-system,fix: Collapsible fixes: type=button and opaque sticky header,https://github.com/cultureamp/kaizen-design-system/pull/1722,2021-06-25T02:11:44Z,2021-06-25T06:48:07Z,1,4,MERGED
kaizen-design-system,fix: Add better RTL support to BrandMoment,https://github.com/cultureamp/kaizen-design-system/pull/1720,2021-06-23T05:22:01Z,2021-06-24T06:09:05Z,2,3,MERGED
kaizen-design-system,feat: Create @kaizen/responsive package with useMediaQueries hook,https://github.com/cultureamp/kaizen-design-system/pull/1716,2021-06-22T06:25:12Z,2021-07-12T07:36:10Z,12,14,MERGED
kaizen-design-system,feat: controlHasUnconstrainedHeight option for Elm Select,https://github.com/cultureamp/kaizen-design-system/pull/1715,2021-06-22T06:23:16Z,2021-06-24T04:03:26Z,6,4,MERGED
kaizen-design-system,fix: update Elm select clear button color for Heart,https://github.com/cultureamp/kaizen-design-system/pull/1707,2021-06-18T04:39:48Z,2021-06-18T04:44:36Z,2,1,MERGED
kaizen-design-system,fix: elm tooltip heart uplift quick fix,https://github.com/cultureamp/kaizen-design-system/pull/1705,2021-06-15T06:56:28Z,2021-06-17T04:56:56Z,2,1,MERGED
kaizen-design-system,fix: Stop propagation at top of modal,https://github.com/cultureamp/kaizen-design-system/pull/1701,2021-06-10T03:33:32Z,2021-06-10T05:10:54Z,0,2,MERGED
kaizen-design-system,"fix: change elm select ""faded"" placeholder from wisteria-300 to 800",https://github.com/cultureamp/kaizen-design-system/pull/1695,2021-06-09T07:55:21Z,2021-06-11T00:38:27Z,2,2,MERGED
kaizen-design-system,fix: Update Collapsible colours to be more Heart compatible,https://github.com/cultureamp/kaizen-design-system/pull/1694,2021-06-08T07:40:13Z,2021-06-08T23:37:34Z,2,1,MERGED
