repo_name,pr_title,pr_url,created_at,closed_at,total_comments,total_commits,state
kaizen-design-system,fix: add new survey statuses to title block zen component,https://github.com/cultureamp/kaizen-design-system/pull/1673,2021-06-03T06:53:29Z,2021-06-07T01:35:13Z,6,6,MERGED
kaizen-design-system,feat: elm tag allow text wrapping option + dismiss button size fix,https://github.com/cultureamp/kaizen-design-system/pull/1671,2021-06-03T01:39:25Z,2021-06-07T00:21:50Z,3,3,MERGED
kaizen-design-system,chore: Run design-tokens prepublish on dev builds,https://github.com/cultureamp/kaizen-design-system/pull/1802,2021-07-30T01:49:54Z,2021-08-11T06:36:48Z,1,2,MERGED
kaizen-design-system,fix: show tooltips in chromatic tests,https://github.com/cultureamp/kaizen-design-system/pull/1800,2021-07-29T23:35:19Z,2021-08-02T01:11:40Z,3,2,MERGED
kaizen-design-system,fix: Tag dismiss button accessibility + uplift,https://github.com/cultureamp/kaizen-design-system/pull/1798,2021-07-29T06:18:52Z,2021-07-29T07:05:56Z,1,4,MERGED
kaizen-design-system,docs: Group components in Storybook,https://github.com/cultureamp/kaizen-design-system/pull/1794,2021-07-28T03:34:51Z,2021-08-02T04:44:29Z,1,2,MERGED
kaizen-design-system,fix: remove input edit modal typography that's adding a gap,https://github.com/cultureamp/kaizen-design-system/pull/1782,2021-07-21T06:39:13Z,2021-07-21T07:04:56Z,2,2,MERGED
kaizen-design-system,fix: make disabled colours on MenuItem match the designs in UI Kit,https://github.com/cultureamp/kaizen-design-system/pull/1781,2021-07-21T06:27:43Z,2021-08-02T03:08:55Z,3,8,MERGED
kaizen-design-system,fix: Select types passing through to consumer,https://github.com/cultureamp/kaizen-design-system/pull/1780,2021-07-21T04:05:07Z,2021-07-21T05:05:28Z,0,1,MERGED
kaizen-design-system,fix: Change checkbox inactive hover colour to stone,https://github.com/cultureamp/kaizen-design-system/pull/1775,2021-07-19T08:45:38Z,2021-07-19T23:02:26Z,1,1,MERGED
kaizen-design-system,feat: Allow the TitleBlockZen to generate an avatar instead of having a component passed in,https://github.com/cultureamp/kaizen-design-system/pull/1771,2021-07-17T06:25:06Z,2021-07-19T03:38:24Z,2,8,MERGED
kaizen-design-system,docs: Adjust import helpers on stories for Storybook 6 (first half),https://github.com/cultureamp/kaizen-design-system/pull/1766,2021-07-16T00:18:50Z,2021-07-16T01:43:32Z,2,3,MERGED
kaizen-design-system,fix: correct spacing between stacked tags within multi select,https://github.com/cultureamp/kaizen-design-system/pull/1755,2021-07-13T06:51:33Z,2021-07-14T00:05:34Z,2,2,MERGED
kaizen-design-system,feat: Remove title from back of Tile component,https://github.com/cultureamp/kaizen-design-system/pull/1753,2021-07-13T03:39:57Z,2021-07-15T07:28:49Z,7,1,MERGED
kaizen-design-system,fix: Make buttons full width at small viewport,https://github.com/cultureamp/kaizen-design-system/pull/1752,2021-07-13T02:59:37Z,2021-07-13T07:45:33Z,2,1,MERGED
kaizen-design-system,fix: Delete template Slider README,https://github.com/cultureamp/kaizen-design-system/pull/1744,2021-07-05T07:48:20Z,2021-07-06T01:22:13Z,1,3,MERGED
kaizen-design-system,feat: Deprecated and removed tokens rule uplift,https://github.com/cultureamp/kaizen-design-system/pull/1743,2021-07-05T06:48:54Z,2021-08-06T06:24:53Z,59,55,MERGED
kaizen-design-system,docs: Fix padding in cultureamp.design,https://github.com/cultureamp/kaizen-design-system/pull/1903,2021-08-30T09:03:09Z,2021-08-30T23:35:37Z,1,4,MERGED
kaizen-design-system,docs: Uplift styles in cultureamp.design,https://github.com/cultureamp/kaizen-design-system/pull/1893,2021-08-24T09:09:17Z,2021-08-30T07:29:29Z,5,10,MERGED
kaizen-design-system,"docs: Remove the ""not built"" string in documenation pages",https://github.com/cultureamp/kaizen-design-system/pull/1886,2021-08-24T01:03:39Z,2021-08-24T01:45:26Z,1,1,MERGED
kaizen-design-system,feat: add ability to have first line underneath the heading,https://github.com/cultureamp/kaizen-design-system/pull/1885,2021-08-24T00:29:59Z,2021-08-24T03:48:06Z,8,2,MERGED
kaizen-design-system,docs: adding labels to each component to tie our open issues that are labelled to our gatsby docs,https://github.com/cultureamp/kaizen-design-system/pull/1860,2021-08-19T00:29:15Z,2021-08-20T04:50:34Z,1,5,MERGED
kaizen-design-system,feat: Add Kaizen eslint plugin,https://github.com/cultureamp/kaizen-design-system/pull/1859,2021-08-19T00:17:03Z,2021-09-03T00:53:51Z,6,18,MERGED
kaizen-design-system,feat: Progress Bar (new component),https://github.com/cultureamp/kaizen-design-system/pull/1852,2021-08-17T04:20:56Z,2021-08-27T01:02:14Z,23,30,MERGED
kaizen-design-system,chore(site): Add relevant issues to component pages,https://github.com/cultureamp/kaizen-design-system/pull/1850,2021-08-16T08:56:25Z,2021-08-17T04:27:08Z,4,7,MERGED
kaizen-design-system,fix: update text field error styles,https://github.com/cultureamp/kaizen-design-system/pull/1828,2021-08-10T06:52:43Z,2021-09-13T03:27:38Z,2,10,MERGED
kaizen-design-system,docs: Add component health information to docs and display on website,https://github.com/cultureamp/kaizen-design-system/pull/1825,2021-08-10T01:36:56Z,2021-08-17T07:36:08Z,10,13,MERGED
kaizen-design-system,fix: add secondary destructive variant to IconButton,https://github.com/cultureamp/kaizen-design-system/pull/1977,2021-09-28T06:39:55Z,2021-10-05T04:22:28Z,1,4,MERGED
kaizen-design-system,docs: Add readme stubs for implemented but undocumented components,https://github.com/cultureamp/kaizen-design-system/pull/1967,2021-09-22T06:22:23Z,2021-09-23T02:30:15Z,2,7,MERGED
kaizen-design-system,feat: Create new version of Slider in Form package,https://github.com/cultureamp/kaizen-design-system/pull/1956,2021-09-16T05:57:38Z,2021-10-07T01:24:58Z,5,73,MERGED
kaizen-design-system,ci: Add CodeQL action,https://github.com/cultureamp/kaizen-design-system/pull/1953,2021-09-16T04:24:35Z,2021-09-16T04:41:26Z,1,2,MERGED
kaizen-design-system,fix: Use min-height:100vh on small viewport as well,https://github.com/cultureamp/kaizen-design-system/pull/1944,2021-09-09T01:05:01Z,2021-09-09T01:56:07Z,0,2,MERGED
kaizen-design-system,fix: Use IconButton for hamburger menu button instead of div,https://github.com/cultureamp/kaizen-design-system/pull/1942,2021-09-07T00:48:48Z,2021-09-07T02:37:24Z,2,2,MERGED
kaizen-design-system,feat: add new variants of well,https://github.com/cultureamp/kaizen-design-system/pull/1939,2021-09-06T07:04:02Z,2021-09-06T23:42:04Z,2,3,MERGED
kaizen-design-system,docs: add an example of passing a name with non-latin characters to Avatar,https://github.com/cultureamp/kaizen-design-system/pull/1924,2021-09-02T06:29:14Z,2021-09-02T06:42:05Z,1,1,MERGED
kaizen-design-system,fix: update legacy $ca-border-color to use latest design token,https://github.com/cultureamp/kaizen-design-system/pull/2116,2021-10-22T04:44:44Z,2021-10-22T05:18:36Z,1,2,MERGED
kaizen-design-system,fix: elm field description styles,https://github.com/cultureamp/kaizen-design-system/pull/2115,2021-10-22T03:36:29Z,2021-10-22T03:44:38Z,0,1,MERGED
kaizen-design-system,feat: update workspaces config for lerna,https://github.com/cultureamp/kaizen-design-system/pull/2114,2021-10-22T00:58:32Z,2021-10-22T01:10:58Z,1,3,MERGED
kaizen-design-system,feat: apply illustration styles to video element,https://github.com/cultureamp/kaizen-design-system/pull/2108,2021-10-21T06:06:21Z,2021-10-22T02:19:27Z,3,3,MERGED
kaizen-design-system,fix: Update typography-data-small tokens to use the correct font,https://github.com/cultureamp/kaizen-design-system/pull/2102,2021-10-20T04:30:21Z,2021-10-21T00:19:49Z,3,5,MERGED
kaizen-design-system,feat: Add reversed variants of RadioFields and RadioGroups,https://github.com/cultureamp/kaizen-design-system/pull/2101,2021-10-20T00:30:42Z,2021-10-22T02:49:43Z,12,9,MERGED
kaizen-design-system,feat: BREAKING CHANGE: complete restructure of component for accessibility audit,https://github.com/cultureamp/kaizen-design-system/pull/2093,2021-10-19T00:15:58Z,2021-10-25T04:22:52Z,13,15,MERGED
kaizen-design-system,feat: BREAKING CHANGE: complete restructure of component for accessibility audit,https://github.com/cultureamp/kaizen-design-system/pull/2091,2021-10-18T03:13:45Z,2021-10-19T00:02:25Z,3,142,MERGED
kaizen-design-system,feat: Implement a sensible default colour for icons when -ms-high-contrast is active,https://github.com/cultureamp/kaizen-design-system/pull/2088,2021-10-15T05:15:17Z,2021-10-15T05:54:25Z,1,5,MERGED
kaizen-design-system,feat: Add reversed variants of checkbox fields,https://github.com/cultureamp/kaizen-design-system/pull/2087,2021-10-15T02:57:29Z,2021-10-20T22:38:09Z,4,9,MERGED
kaizen-design-system,"fix: Show SearchField label on default, not on secondary",https://github.com/cultureamp/kaizen-design-system/pull/2085,2021-10-15T01:17:27Z,2021-10-15T03:04:54Z,1,2,MERGED
kaizen-design-system,"fix: Use Label disabled styling for Checkbox, Radio & ToggleSwitch",https://github.com/cultureamp/kaizen-design-system/pull/2082,2021-10-14T10:27:46Z,2021-10-14T23:01:26Z,1,5,MERGED
kaizen-design-system,fix: add override css in form/slider for performance ui,https://github.com/cultureamp/kaizen-design-system/pull/2077,2021-10-14T06:47:40Z,2021-10-14T22:30:14Z,3,4,MERGED
kaizen-design-system,feat: adding percentage icon,https://github.com/cultureamp/kaizen-design-system/pull/2071,2021-10-14T01:06:56Z,2021-10-14T21:22:49Z,4,2,MERGED
kaizen-design-system,fix: update breadcrumb text link to style next to back button on wide views,https://github.com/cultureamp/kaizen-design-system/pull/2068,2021-10-13T05:58:38Z,2021-10-13T07:21:52Z,2,1,MERGED
kaizen-design-system,feat: add primary and primary reversed to icon button,https://github.com/cultureamp/kaizen-design-system/pull/1985,2021-10-06T02:36:35Z,2021-10-06T23:20:12Z,6,3,MERGED
kaizen-design-system,feat: Add Profile varient to Tag,https://github.com/cultureamp/kaizen-design-system/pull/2330,2021-11-30T02:01:28Z,2021-12-14T23:59:17Z,8,9,MERGED
kaizen-design-system,fix: Update purple borders on Hierarchical Select,https://github.com/cultureamp/kaizen-design-system/pull/2325,2021-11-29T01:29:18Z,2021-12-02T02:53:18Z,2,4,MERGED
kaizen-design-system,fix: update ContextModal design and remove previously informationModal,https://github.com/cultureamp/kaizen-design-system/pull/2323,2021-11-29T00:17:58Z,2021-12-01T01:23:44Z,5,4,MERGED
kaizen-design-system,feat: add aspect ratio container for illustrations for ease of replacing with new illustrations,https://github.com/cultureamp/kaizen-design-system/pull/2322,2021-11-29T00:12:16Z,2021-11-30T23:44:18Z,7,9,MERGED
kaizen-design-system,feat: Update badge to include new variants and design,https://github.com/cultureamp/kaizen-design-system/pull/2314,2021-11-26T02:32:34Z,2021-12-13T00:44:11Z,5,13,MERGED
kaizen-design-system,fix: Update Input Edit Modal to use new styles and created new StoryBook,https://github.com/cultureamp/kaizen-design-system/pull/2300,2021-11-21T23:53:46Z,2021-11-24T00:12:34Z,19,7,MERGED
kaizen-design-system,fix: Update Input Edit Modal to use new styles and created new StoryBook,https://github.com/cultureamp/kaizen-design-system/pull/2298,2021-11-19T00:15:21Z,2021-11-21T23:51:21Z,1,2,CLOSED
kaizen-design-system,fix: Remove titleblock title truncation,https://github.com/cultureamp/kaizen-design-system/pull/2297,2021-11-18T04:32:22Z,2021-11-19T00:58:56Z,1,2,MERGED
kaizen-design-system,chore: Fixing icons overlapping sticky header on health page,https://github.com/cultureamp/kaizen-design-system/pull/2292,2021-11-16T06:39:32Z,2021-11-16T22:42:48Z,1,2,MERGED
kaizen-design-system,feat: Column component,https://github.com/cultureamp/kaizen-design-system/pull/2286,2021-11-14T22:43:03Z,2022-02-03T07:34:05Z,5,11,CLOSED
kaizen-design-system,fix: apply nowrap to tag contents,https://github.com/cultureamp/kaizen-design-system/pull/2278,2021-11-11T00:25:05Z,2021-11-11T00:38:45Z,1,2,MERGED
kaizen-design-system,docs: Component health page to calculate percentage done per column,https://github.com/cultureamp/kaizen-design-system/pull/2276,2021-11-10T08:29:19Z,2021-11-16T04:40:29Z,2,7,MERGED
kaizen-design-system,fix: Add type=search specificity to override perf-ui materialize,https://github.com/cultureamp/kaizen-design-system/pull/2271,2021-11-09T05:56:09Z,2021-11-09T06:07:50Z,1,2,MERGED
kaizen-design-system,fix: override global figure styles coming from material ui,https://github.com/cultureamp/kaizen-design-system/pull/2270,2021-11-09T05:38:58Z,2021-11-09T05:44:06Z,0,1,MERGED
kaizen-design-system,fix: export visiuallyHidden props to fix build,https://github.com/cultureamp/kaizen-design-system/pull/2209,2021-11-08T03:04:03Z,2021-11-08T03:15:15Z,0,1,MERGED
kaizen-design-system,feat: Create new Tabs component,https://github.com/cultureamp/kaizen-design-system/pull/2203,2021-11-04T06:20:33Z,2021-11-08T04:22:33Z,7,8,MERGED
kaizen-design-system,feat: added mood prop to InformationTile and MultiActionTile,https://github.com/cultureamp/kaizen-design-system/pull/2202,2021-11-04T04:55:15Z,2021-11-05T06:12:29Z,2,3,MERGED
kaizen-design-system,chore(site): Update Footer to allow users to manage their cookies for GDPR requirements,https://github.com/cultureamp/kaizen-design-system/pull/2193,2021-11-01T04:33:02Z,2021-11-17T04:26:43Z,2,7,MERGED
kaizen-design-system,feat: add isElevated prop to Card component wrapper and support for new variants backgrounds,https://github.com/cultureamp/kaizen-design-system/pull/2380,2021-12-24T05:46:17Z,2022-01-05T04:24:11Z,6,6,MERGED
kaizen-design-system,feat: Add AvatarGroup component to Kaizen Library,https://github.com/cultureamp/kaizen-design-system/pull/2377,2021-12-22T00:02:07Z,2022-01-10T03:08:40Z,16,17,MERGED
kaizen-design-system,docs: Fix Storybook Design Tokens pages not loading [KDS-73],https://github.com/cultureamp/kaizen-design-system/pull/2362,2021-12-13T05:18:52Z,2021-12-13T23:51:25Z,1,3,MERGED
kaizen-design-system,fix: add fallback for aspect ratio styles in safari 14,https://github.com/cultureamp/kaizen-design-system/pull/2356,2021-12-10T05:32:28Z,2021-12-12T23:40:33Z,1,1,MERGED
kaizen-design-system,fix: Add padding-right to GuidanceBlock description container,https://github.com/cultureamp/kaizen-design-system/pull/2352,2021-12-09T01:30:02Z,2021-12-09T06:47:20Z,1,2,MERGED
kaizen-design-system,"feat: add company variants to Avatar, update storybook format and add test coverage",https://github.com/cultureamp/kaizen-design-system/pull/2351,2021-12-08T22:33:12Z,2021-12-20T03:27:37Z,18,13,MERGED
kaizen-design-system,feat: Add new variants to Global Notification [KDS-49],https://github.com/cultureamp/kaizen-design-system/pull/2349,2021-12-08T00:48:18Z,2021-12-16T05:19:02Z,7,5,MERGED
kaizen-design-system,feat: DatePicker setup basic single date picker,https://github.com/cultureamp/kaizen-design-system/pull/2499,2022-01-31T23:26:19Z,2022-02-06T22:28:42Z,7,6,CLOSED
kaizen-design-system,feat: text area uplift,https://github.com/cultureamp/kaizen-design-system/pull/2497,2022-01-31T06:13:25Z,2022-02-04T00:09:40Z,3,35,MERGED
kaizen-design-system,fix: extended props availability,https://github.com/cultureamp/kaizen-design-system/pull/2436,2022-01-26T00:31:11Z,2022-01-26T06:49:49Z,2,4,MERGED
kaizen-design-system,feat: improve RadioGroup accessibility,https://github.com/cultureamp/kaizen-design-system/pull/2426,2022-01-25T04:25:01Z,2022-01-25T23:33:07Z,9,1,MERGED
kaizen-design-system,fix: update all division in sass to use calc or built in math.div,https://github.com/cultureamp/kaizen-design-system/pull/2415,2022-01-24T03:12:53Z,2022-05-11T07:40:41Z,9,4,CLOSED
kaizen-design-system,chore: update yeoman-generator to address CVE-2022-0144 vulnerability,https://github.com/cultureamp/kaizen-design-system/pull/2414,2022-01-24T03:07:41Z,2022-01-24T22:47:33Z,1,1,MERGED
kaizen-design-system,fix: Guidance block content alignment and show arrow button,https://github.com/cultureamp/kaizen-design-system/pull/2408,2022-01-20T22:09:07Z,2022-01-30T22:19:34Z,4,8,MERGED
kaizen-design-system,feat: Update the demoStoryId to match new stories,https://github.com/cultureamp/kaizen-design-system/pull/2404,2022-01-17T22:43:26Z,2022-01-18T22:38:01Z,1,6,MERGED
kaizen-design-system,fix: explicitly set border-bottom: none on Avatar component,https://github.com/cultureamp/kaizen-design-system/pull/2403,2022-01-17T01:50:33Z,2022-01-17T02:13:21Z,1,1,MERGED
kaizen-design-system,feat: Add variants and update stories for Popover,https://github.com/cultureamp/kaizen-design-system/pull/2402,2022-01-17T00:52:39Z,2022-01-27T02:05:02Z,9,27,MERGED
kaizen-design-system,feat: tooltip placement for scroll and left/right,https://github.com/cultureamp/kaizen-design-system/pull/2389,2022-01-07T04:53:51Z,2022-01-12T22:06:10Z,3,9,MERGED
kaizen-design-system,feat: new Tooltip mood variants,https://github.com/cultureamp/kaizen-design-system/pull/2386,2022-01-06T22:54:53Z,2022-01-07T00:02:19Z,2,4,MERGED
kaizen-design-system,feat: DirectionalLink and BreadcrumbLink button variant,https://github.com/cultureamp/kaizen-design-system/pull/2571,2022-02-28T04:33:43Z,2022-05-02T01:22:33Z,23,33,MERGED
kaizen-design-system,docs: upgrade checkboxfield stories to use storyWrapper,https://github.com/cultureamp/kaizen-design-system/pull/2570,2022-02-28T04:09:17Z,2022-05-16T07:36:43Z,3,3,CLOSED
kaizen-design-system,docs: update button to use storyWrapper,https://github.com/cultureamp/kaizen-design-system/pull/2568,2022-02-25T05:01:19Z,2022-03-02T23:33:35Z,3,5,MERGED
kaizen-design-system,docs: update divider stories to use storyWrapper,https://github.com/cultureamp/kaizen-design-system/pull/2567,2022-02-25T04:13:15Z,2022-03-02T05:57:46Z,3,8,MERGED
kaizen-design-system,docs: update Card to use storyWrapper,https://github.com/cultureamp/kaizen-design-system/pull/2566,2022-02-25T03:53:55Z,2022-03-01T03:36:14Z,2,5,MERGED
kaizen-design-system,docs: Update brand stories to use StoryWrapper,https://github.com/cultureamp/kaizen-design-system/pull/2563,2022-02-25T00:11:26Z,2022-03-01T07:00:23Z,2,10,MERGED
kaizen-design-system,docs: Upgrade badge stories to use storyWrapper,https://github.com/cultureamp/kaizen-design-system/pull/2562,2022-02-24T23:53:59Z,2022-03-07T03:35:42Z,4,7,MERGED
kaizen-design-system,docs: Update avatar stories to use storyWrapper,https://github.com/cultureamp/kaizen-design-system/pull/2561,2022-02-24T23:11:22Z,2022-03-01T02:52:30Z,8,11,MERGED
kaizen-design-system,fix: give calendar popup a z-index and background-color,https://github.com/cultureamp/kaizen-design-system/pull/2548,2022-02-21T02:57:17Z,2022-02-21T03:36:11Z,2,2,MERGED
kaizen-design-system,fix: Changed icon color for `validationPositive` variant of tag to darker green [KDS-220],https://github.com/cultureamp/kaizen-design-system/pull/2547,2022-02-21T02:10:37Z,2022-02-22T02:43:52Z,1,9,MERGED
kaizen-design-system,chore: add doc-block deprecate warning to button,https://github.com/cultureamp/kaizen-design-system/pull/2534,2022-02-15T22:49:22Z,2022-02-15T23:11:19Z,0,1,MERGED
kaizen-design-system,feat: DatePicker ,https://github.com/cultureamp/kaizen-design-system/pull/2526,2022-02-11T02:29:36Z,2022-02-16T22:14:59Z,16,29,MERGED
kaizen-design-system,feat: add final scene illustrations,https://github.com/cultureamp/kaizen-design-system/pull/2524,2022-02-10T21:32:18Z,2022-02-10T22:45:48Z,1,2,MERGED
kaizen-design-system,chore: Kaizen Site scrolls to top of page when selecting different animation preset on animation guidelines [KDS-190],https://github.com/cultureamp/kaizen-design-system/pull/2518,2022-02-08T03:44:23Z,2022-02-08T05:23:09Z,1,3,MERGED
kaizen-design-system,feat: date picker input and calendar styling,https://github.com/cultureamp/kaizen-design-system/pull/2511,2022-02-06T22:29:37Z,2022-02-08T00:37:53Z,21,16,MERGED
kaizen-design-system,chore: fix chromatic false positives,https://github.com/cultureamp/kaizen-design-system/pull/2507,2022-02-03T23:54:42Z,2022-02-14T23:45:04Z,1,4,MERGED
kaizen-design-system,fix: resolve aspect ratio issue in guidance block,https://github.com/cultureamp/kaizen-design-system/pull/2504,2022-02-02T01:19:32Z,2022-02-17T04:30:09Z,5,18,MERGED
kaizen-design-system,feat: LoadingGraphic and update loading skeleton story,https://github.com/cultureamp/kaizen-design-system/pull/2665,2022-03-31T23:45:18Z,2022-04-21T23:14:49Z,4,24,MERGED
kaizen-design-system,feat(splitbutton): add SplitButton package,https://github.com/cultureamp/kaizen-design-system/pull/2654,2022-03-29T08:54:07Z,2022-04-06T03:13:59Z,4,5,MERGED
kaizen-design-system,"feat: create daterangepicker, formatting utils and tests",https://github.com/cultureamp/kaizen-design-system/pull/2649,2022-03-29T00:55:45Z,2022-04-08T03:10:46Z,7,14,MERGED
kaizen-design-system,feat: loadingheading component and loadingSkeleton stories,https://github.com/cultureamp/kaizen-design-system/pull/2644,2022-03-24T05:16:43Z,2022-03-29T22:38:20Z,4,5,MERGED
kaizen-design-system,feat: create loading-skeleton package and loadingParagraph component,https://github.com/cultureamp/kaizen-design-system/pull/2640,2022-03-23T05:01:24Z,2022-03-24T03:11:27Z,3,6,MERGED
kaizen-design-system,feat: Add description prop to Select,https://github.com/cultureamp/kaizen-design-system/pull/2621,2022-03-16T05:37:41Z,2022-03-16T12:50:56Z,1,1,MERGED
kaizen-design-system,feat: Add error state to Select component,https://github.com/cultureamp/kaizen-design-system/pull/2607,2022-03-11T00:25:48Z,2022-03-11T05:10:12Z,2,10,MERGED
kaizen-design-system,docs: update buttons story name and controls,https://github.com/cultureamp/kaizen-design-system/pull/2603,2022-03-09T23:47:14Z,2022-03-10T00:50:27Z,2,5,MERGED
kaizen-design-system,docs: update select stories to use storyWrapper,https://github.com/cultureamp/kaizen-design-system/pull/2601,2022-03-09T06:19:31Z,2022-03-22T22:10:33Z,3,5,MERGED
kaizen-design-system,docs: update split button stories to use storywrapper,https://github.com/cultureamp/kaizen-design-system/pull/2600,2022-03-09T06:19:28Z,2022-03-21T02:52:13Z,2,2,MERGED
kaizen-design-system,docs: update tag stories to use storyWrapper,https://github.com/cultureamp/kaizen-design-system/pull/2599,2022-03-09T06:19:24Z,2022-03-24T02:43:48Z,7,11,MERGED
kaizen-design-system,feat: Update new start and end icons,https://github.com/cultureamp/kaizen-design-system/pull/2597,2022-03-09T05:01:56Z,2022-03-09T05:40:19Z,1,2,MERGED
kaizen-design-system,docs: update likert scale stories to use storyWrapper,https://github.com/cultureamp/kaizen-design-system/pull/2594,2022-03-08T04:43:07Z,2022-03-22T23:33:09Z,8,9,MERGED
kaizen-design-system,docs: update progressbar stories to use storyWrapper,https://github.com/cultureamp/kaizen-design-system/pull/2593,2022-03-08T04:41:23Z,2022-03-09T23:59:23Z,4,5,MERGED
kaizen-design-system,feat: Add new start and end icons,https://github.com/cultureamp/kaizen-design-system/pull/2588,2022-03-07T05:00:10Z,2022-03-07T05:14:55Z,1,1,MERGED
kaizen-design-system,docs: update popover stories to use StoryWrapper and sticker sheet,https://github.com/cultureamp/kaizen-design-system/pull/2586,2022-03-07T03:40:55Z,2022-05-20T07:35:36Z,3,2,CLOSED
kaizen-design-system,feat: Datepicker chromatic stories,https://github.com/cultureamp/kaizen-design-system/pull/2579,2022-03-02T21:56:37Z,2022-03-03T04:36:13Z,2,9,MERGED
kaizen-design-system,docs: update inline notification stories to use storyWrapper,https://github.com/cultureamp/kaizen-design-system/pull/2575,2022-03-01T21:42:22Z,2022-03-09T04:06:40Z,4,10,MERGED
kaizen-design-system,docs: update searchfield to use StoryWrapper,https://github.com/cultureamp/kaizen-design-system/pull/2574,2022-03-01T09:17:56Z,2022-03-01T22:34:34Z,1,2,MERGED
kaizen-design-system,docs(inputeditmodal): improve stories to showcase sample code,https://github.com/cultureamp/kaizen-design-system/pull/2701,2022-04-29T01:14:00Z,2022-04-29T02:19:53Z,1,3,MERGED
kaizen-design-system,feat: DateInputPicker,https://github.com/cultureamp/kaizen-design-system/pull/2695,2022-04-20T23:12:24Z,2022-06-21T23:45:59Z,41,59,CLOSED
kaizen-design-system,fix: Breadcrumb link in Title Block to use correct underline color [KDS-240],https://github.com/cultureamp/kaizen-design-system/pull/2671,2022-04-04T06:37:48Z,2022-04-05T06:18:24Z,1,4,MERGED
kaizen-design-system,feat: border styles for likert scale,https://github.com/cultureamp/kaizen-design-system/pull/2670,2022-04-04T06:25:35Z,2022-04-13T03:40:19Z,2,9,MERGED
kaizen-design-system,chore: storyboard links for pagination components,https://github.com/cultureamp/kaizen-design-system/pull/2763,2022-05-30T07:02:51Z,2022-05-31T00:36:54Z,2,1,MERGED
kaizen-design-system,chore: Add links to Guidance and Storyboard to component JSDoc,https://github.com/cultureamp/kaizen-design-system/pull/2758,2022-05-26T05:12:26Z,2022-05-30T06:57:01Z,9,1,MERGED
kaizen-design-system,fix: Use interpolation for RTE height calculation,https://github.com/cultureamp/kaizen-design-system/pull/2750,2022-05-24T05:56:57Z,2022-05-24T06:04:25Z,1,1,MERGED
kaizen-design-system,feat: Add validation to DatePicker,https://github.com/cultureamp/kaizen-design-system/pull/2729,2022-05-13T04:27:51Z,2022-05-31T05:37:54Z,52,19,MERGED
kaizen-design-system,refactor(button): show button pseudo states in stories,https://github.com/cultureamp/kaizen-design-system/pull/2728,2022-05-13T01:05:22Z,2022-05-30T06:03:12Z,4,5,MERGED
kaizen-design-system,fix: Enable noUncheckedIndexedAccess for design tokens and fix TS errors,https://github.com/cultureamp/kaizen-design-system/pull/2725,2022-05-12T04:03:15Z,2022-05-12T06:01:47Z,2,2,MERGED
kaizen-design-system,feat: DateInputPicker,https://github.com/cultureamp/kaizen-design-system/pull/2718,2022-05-05T04:44:58Z,2022-05-10T23:49:34Z,45,57,MERGED
kaizen-design-system,feat: Add en-AU and en-US localisation,https://github.com/cultureamp/kaizen-design-system/pull/2839,2022-06-28T07:35:24Z,2022-06-30T01:19:20Z,2,21,MERGED
