repo_name,pr_title,pr_url,created_at,closed_at,total_comments,total_commits,state
JabRefOnline,Convert resolver to class,https://github.com/JabRef/JabRefOnline/pull/159,2021-05-30T21:20:55Z,2021-07-17T14:58:47Z,1,11,MERGED
JabRefOnline,Add end2end testing,https://github.com/JabRef/JabRefOnline/pull/138,2021-05-26T21:39:02Z,2021-11-08T21:59:07Z,1,1,CLOSED
JabRefOnline,Mutations for forgot password,https://github.com/JabRef/JabRefOnline/pull/121,2021-05-21T16:33:17Z,2021-06-13T10:33:53Z,39,43,MERGED
JabRefOnline,Add session-store to express,https://github.com/JabRef/JabRefOnline/pull/120,2021-05-21T12:03:22Z,2021-06-11T18:58:22Z,2,7,MERGED
JabRefOnline,Mutations for forgot-password and add session store,https://github.com/JabRef/JabRefOnline/pull/118,2021-05-18T10:26:04Z,2021-05-18T12:40:49Z,1,4,CLOSED
JabRefOnline,Mutations for forgot-password operation,https://github.com/JabRef/JabRefOnline/pull/117,2021-05-18T09:32:26Z,2021-05-18T10:18:40Z,1,4,CLOSED
JabRefOnline,Put deployment into seperate workflow,https://github.com/JabRef/JabRefOnline/pull/116,2021-05-17T13:03:51Z,2021-05-17T13:06:56Z,0,2,MERGED
JabRefOnline,Add integration tests,https://github.com/JabRef/JabRefOnline/pull/108,2021-05-13T22:29:28Z,2021-05-14T11:47:13Z,0,7,MERGED
JabRefOnline,Bump @graphql-tools/schema from 8.0.0-alpha-6813e81f.0 to 8.0.0,https://github.com/JabRef/JabRefOnline/pull/311,2021-07-28T12:21:29Z,2021-07-28T12:29:46Z,0,3,MERGED
JabRefOnline,Run tests on all os and for node 16 as well,https://github.com/JabRef/JabRefOnline/pull/250,2021-07-07T21:06:14Z,2021-07-07T21:10:00Z,1,1,CLOSED
JabRefOnline,Remove explicit dependency on vue/composition api,https://github.com/JabRef/JabRefOnline/pull/245,2021-07-05T15:22:58Z,2021-07-05T19:09:41Z,0,2,MERGED
JabRefOnline,Use node-action's new cache function,https://github.com/JabRef/JabRefOnline/pull/228,2021-07-04T18:39:32Z,2021-07-04T18:49:10Z,0,1,MERGED
JabRefOnline,Also use lint rules that require type checks,https://github.com/JabRef/JabRefOnline/pull/227,2021-06-30T21:10:42Z,2021-07-01T18:33:15Z,1,3,MERGED
JabRefOnline,Add error handling,https://github.com/JabRef/JabRefOnline/pull/226,2021-06-29T01:59:09Z,2021-09-13T19:40:29Z,20,34,MERGED
JabRefOnline,Add linting for graphql files,https://github.com/JabRef/JabRefOnline/pull/166,2021-06-03T21:19:18Z,2021-07-01T15:44:45Z,0,5,MERGED
JabRefOnline,Add Gitpod integration,https://github.com/JabRef/JabRefOnline/pull/574,2021-10-22T20:54:31Z,2021-10-22T21:11:31Z,1,6,MERGED
JabRefOnline,Add VS Code tasks,https://github.com/JabRef/JabRefOnline/pull/560,2021-10-21T18:19:32Z,2021-10-21T18:23:30Z,0,1,MERGED
JabRefOnline,Fix seed command and add missing migration,https://github.com/JabRef/JabRefOnline/pull/559,2021-10-21T18:05:12Z,2021-10-21T18:18:42Z,0,1,MERGED
JabRefOnline,Fix client-side graphql type for dates,https://github.com/JabRef/JabRefOnline/pull/558,2021-10-21T18:03:40Z,2021-10-21T18:18:05Z,0,1,MERGED
JabRefOnline,Bind editor controls to graphql response,https://github.com/JabRef/JabRefOnline/pull/557,2021-10-21T18:01:43Z,2021-10-21T18:28:08Z,0,2,MERGED
JabRefOnline,Update pinia to 2.0.0 rc,https://github.com/JabRef/JabRefOnline/pull/540,2021-10-13T19:23:52Z,2021-10-13T19:49:11Z,0,2,MERGED
JabRefOnline,CI: Reactivate GraphQL validation,https://github.com/JabRef/JabRefOnline/pull/524,2021-10-10T12:21:46Z,2021-10-10T12:25:43Z,0,1,MERGED
JabRefOnline,Run dependabot Friday evening,https://github.com/JabRef/JabRefOnline/pull/523,2021-10-10T12:10:33Z,2021-10-10T12:18:14Z,0,1,MERGED
JabRefOnline,Enable Vite for development,https://github.com/JabRef/JabRefOnline/pull/481,2021-09-16T17:05:20Z,2021-09-16T17:11:08Z,0,1,MERGED
JabRefOnline,Nuxt-bridge,https://github.com/JabRef/JabRefOnline/pull/480,2021-09-16T09:31:06Z,2022-01-08T16:34:12Z,3,103,MERGED
JabRefOnline,Fix caching of current user,https://github.com/JabRef/JabRefOnline/pull/478,2021-09-14T18:48:28Z,2021-09-14T18:51:53Z,0,1,MERGED
JabRefOnline,Remove testing code from start page,https://github.com/JabRef/JabRefOnline/pull/477,2021-09-14T18:47:24Z,2021-09-14T18:51:01Z,0,1,MERGED
JabRefOnline,Add pagination for documents,https://github.com/JabRef/JabRefOnline/pull/476,2021-09-14T14:15:16Z,2021-10-31T16:06:40Z,8,32,MERGED
JabRefOnline,Fix seeding,https://github.com/JabRef/JabRefOnline/pull/465,2021-09-10T18:36:17Z,2021-09-10T18:52:34Z,0,1,MERGED
JabRefOnline,Add update functionality for journal articles,https://github.com/JabRef/JabRefOnline/pull/389,2021-08-22T22:27:38Z,2021-08-22T22:33:16Z,0,1,MERGED
JabRefOnline,Properly add journal articles to db,https://github.com/JabRef/JabRefOnline/pull/388,2021-08-22T10:21:32Z,2021-08-22T10:53:51Z,0,2,MERGED
JabRefOnline,Store page numbers as start + end tuple,https://github.com/JabRef/JabRefOnline/pull/387,2021-08-21T14:01:38Z,2021-08-21T14:11:06Z,0,1,MERGED
JabRefOnline,Add DOI as field,https://github.com/JabRef/JabRefOnline/pull/386,2021-08-21T13:42:54Z,2021-08-21T13:51:48Z,0,1,MERGED
JabRefOnline,Store jounal info in a structured way,https://github.com/JabRef/JabRefOnline/pull/385,2021-08-21T09:06:42Z,2021-08-21T09:23:56Z,0,1,MERGED
JabRefOnline,Use enum for document types,https://github.com/JabRef/JabRefOnline/pull/384,2021-08-20T17:24:57Z,2021-08-20T17:39:27Z,0,1,MERGED
JabRefOnline,Rework how the publication date is handled,https://github.com/JabRef/JabRefOnline/pull/383,2021-08-20T16:51:45Z,2021-08-20T16:55:39Z,0,1,MERGED
JabRefOnline,Store keywords as array in database,https://github.com/JabRef/JabRefOnline/pull/382,2021-08-20T14:25:16Z,2021-08-20T15:05:08Z,0,2,MERGED
JabRefOnline,first attempt at docker image,https://github.com/JabRef/JabRefOnline/pull/381,2021-08-19T19:45:18Z,2022-08-23T19:46:36Z,7,1,CLOSED
JabRefOnline,Change document input types,https://github.com/JabRef/JabRefOnline/pull/363,2021-08-12T22:29:41Z,2021-08-19T22:03:44Z,0,5,MERGED
JabRefOnline,CI: Publish storybook to chromatic,https://github.com/JabRef/JabRefOnline/pull/362,2021-08-11T20:12:52Z,2021-11-08T13:13:48Z,0,3,MERGED
JabRefOnline,Add storybook,https://github.com/JabRef/JabRefOnline/pull/361,2021-08-11T14:15:28Z,2021-08-11T14:32:27Z,0,2,MERGED
JabRefOnline,Migrate to gql-tag-operations,https://github.com/JabRef/JabRefOnline/pull/356,2021-08-09T11:22:23Z,2021-09-13T21:51:02Z,1,17,MERGED
JabRefOnline,Complete rework of documents API,https://github.com/JabRef/JabRefOnline/pull/333,2021-08-08T16:05:04Z,2021-08-10T20:05:32Z,2,8,MERGED
JabRefOnline,Add graphql inspector ci,https://github.com/JabRef/JabRefOnline/pull/330,2021-08-05T14:32:53Z,2023-11-30T11:54:58Z,0,1,CLOSED
JabRefOnline,Remove unused types,https://github.com/JabRef/JabRefOnline/pull/320,2021-08-02T17:08:44Z,2021-08-02T17:26:04Z,0,2,MERGED
JabRefOnline,Add typecheck to ci,https://github.com/JabRef/JabRefOnline/pull/637,2021-11-15T12:11:55Z,2022-01-08T19:14:02Z,1,5,MERGED
JabRefOnline,Improve env detection,https://github.com/JabRef/JabRefOnline/pull/633,2021-11-13T16:53:07Z,2021-11-13T17:00:28Z,0,1,MERGED
JabRefOnline,Replace auth middleware by router guard,https://github.com/JabRef/JabRefOnline/pull/625,2021-11-12T15:24:15Z,2021-11-12T20:19:10Z,0,2,MERGED
JabRefOnline,"Upgrade to jest 27, migrate to esm and use redis-mock for local development",https://github.com/JabRef/JabRefOnline/pull/624,2021-11-10T09:18:42Z,2021-11-14T17:40:19Z,0,9,MERGED
JabRefOnline,Replace bcrpyt by node's built crypto,https://github.com/JabRef/JabRefOnline/pull/623,2021-11-10T09:14:52Z,2021-11-11T13:07:19Z,0,2,MERGED
JabRefOnline,Migrate to other tree library,https://github.com/JabRef/JabRefOnline/pull/618,2021-11-07T18:03:45Z,2021-11-07T18:08:16Z,0,1,MERGED
JabRefOnline,Switch to static rendering mode,https://github.com/JabRef/JabRefOnline/pull/590,2021-11-01T23:24:30Z,2021-11-01T23:38:44Z,0,2,MERGED
JabRefOnline,Add check that all schema changes have a corresponding migration,https://github.com/JabRef/JabRefOnline/pull/960,2022-03-28T12:48:11Z,2022-03-28T13:53:27Z,0,4,MERGED
JabRefOnline,Apollo client update patch,https://github.com/JabRef/JabRefOnline/pull/942,2022-03-22T13:08:29Z,2022-03-22T13:15:59Z,0,2,MERGED
JabRefOnline,Don't hide node_modules and .nuxt in vscode,https://github.com/JabRef/JabRefOnline/pull/941,2022-03-22T12:59:09Z,2022-03-22T13:08:27Z,0,1,MERGED
JabRefOnline,Add codegen to generate typed queries and mutations,https://github.com/JabRef/JabRefOnline/pull/874,2022-02-20T11:19:31Z,2022-10-23T16:38:48Z,9,11,CLOSED
JabRefOnline,Remove apollo-client patch related to ts-invariant/process,https://github.com/JabRef/JabRefOnline/pull/858,2022-02-13T17:15:53Z,2022-08-21T16:36:52Z,1,3,MERGED
JabRefOnline,Use new default typing params for redis client,https://github.com/JabRef/JabRefOnline/pull/857,2022-02-13T16:22:16Z,2022-09-02T21:55:27Z,2,2,CLOSED
JabRefOnline,Upgrade nuxt/bridge,https://github.com/JabRef/JabRefOnline/pull/856,2022-02-13T16:16:36Z,2022-03-21T21:46:11Z,0,5,MERGED
JabRefOnline,Fail on error during nuxt build,https://github.com/JabRef/JabRefOnline/pull/832,2022-02-08T20:28:25Z,2022-02-11T15:32:19Z,0,1,MERGED
JabRefOnline,Enable legacy mode for redis to support connect-redis,https://github.com/JabRef/JabRefOnline/pull/831,2022-02-05T13:50:11Z,2022-08-21T21:37:54Z,9,10,MERGED
JabRefOnline,Migrate auth to new nuxt middleware,https://github.com/JabRef/JabRefOnline/pull/813,2022-01-28T23:23:59Z,2022-08-21T14:23:42Z,0,1,CLOSED
JabRefOnline,Update nuxt/bridge,https://github.com/JabRef/JabRefOnline/pull/812,2022-01-28T20:27:44Z,2022-01-28T22:46:17Z,0,4,MERGED
JabRefOnline,Update patch for new apollo version,https://github.com/JabRef/JabRefOnline/pull/811,2022-01-28T20:11:45Z,2022-01-28T20:27:36Z,0,1,MERGED
JabRefOnline,Fix and improve deployment workflow using environments,https://github.com/JabRef/JabRefOnline/pull/773,2022-01-09T18:20:52Z,2022-01-10T20:39:59Z,0,11,MERGED
JabRefOnline,Remove protected ssr docs,https://github.com/JabRef/JabRefOnline/pull/772,2022-01-08T19:16:02Z,2022-01-08T19:36:02Z,0,1,MERGED
JabRefOnline,Use exitOnceUploaded for Chroma upload,https://github.com/JabRef/JabRefOnline/pull/771,2022-01-08T19:13:08Z,2022-01-08T19:36:47Z,0,1,MERGED
JabRefOnline,Add thank note for chromatic,https://github.com/JabRef/JabRefOnline/pull/1103,2022-05-23T19:54:25Z,2022-05-24T13:53:19Z,0,3,MERGED
JabRefOnline,Add storybook stories for remaining tailwind components,https://github.com/JabRef/JabRefOnline/pull/1081,2022-05-20T00:25:13Z,2022-05-20T20:14:04Z,0,2,MERGED
JabRefOnline,Dependency injection without ts metadata,https://github.com/JabRef/JabRefOnline/pull/1080,2022-05-17T22:50:10Z,2022-05-18T12:01:32Z,0,4,MERGED
JabRefOnline,Add goto-alias as recommended extension,https://github.com/JabRef/JabRefOnline/pull/1061,2022-05-11T22:57:09Z,2022-05-11T23:04:58Z,0,1,MERGED
JabRefOnline,Upgrade to Story Format v3,https://github.com/JabRef/JabRefOnline/pull/1060,2022-05-11T22:56:22Z,2023-02-02T08:22:36Z,1,2,CLOSED
JabRefOnline,Add recommended extensions to gitpod and vscode config,https://github.com/JabRef/JabRefOnline/pull/1059,2022-05-11T21:16:32Z,2022-05-11T21:23:40Z,0,1,MERGED
JabRefOnline,Add story for logo,https://github.com/JabRef/JabRefOnline/pull/1058,2022-05-11T21:13:28Z,2022-05-11T21:32:45Z,0,2,MERGED
JabRefOnline,Migrate to Nuxt 3,https://github.com/JabRef/JabRefOnline/pull/1009,2022-04-21T23:02:38Z,2022-06-24T20:56:23Z,0,75,MERGED
JabRefOnline,Gitpod: move generate to new command,https://github.com/JabRef/JabRefOnline/pull/1008,2022-04-21T20:07:25Z,2022-04-21T20:23:48Z,0,2,MERGED
JabRefOnline,A few small fixes,https://github.com/JabRef/JabRefOnline/pull/1007,2022-04-21T20:00:23Z,2022-04-21T20:09:00Z,0,2,MERGED
JabRefOnline,Database: fix seed by deleting all old data,https://github.com/JabRef/JabRefOnline/pull/1006,2022-04-21T19:43:01Z,2022-04-21T19:50:00Z,0,1,MERGED
JabRefOnline,Gitpod: fix prebuild,https://github.com/JabRef/JabRefOnline/pull/1005,2022-04-21T19:10:32Z,2022-04-21T19:17:40Z,0,1,MERGED
JabRefOnline,Gitpod: disable nuxt telemetry,https://github.com/JabRef/JabRefOnline/pull/1004,2022-04-21T18:54:28Z,2022-04-21T19:02:20Z,0,1,MERGED
JabRefOnline,Migrate VS launch config to nuxi,https://github.com/JabRef/JabRefOnline/pull/1245,2022-07-31T16:18:01Z,2023-01-23T08:04:10Z,2,2,CLOSED
JabRefOnline,Add Postman for e2e API tests,https://github.com/JabRef/JabRefOnline/pull/1244,2022-07-24T19:08:41Z,2022-07-24T20:44:16Z,5,13,MERGED
JabRefOnline,Fix login,https://github.com/JabRef/JabRefOnline/pull/1243,2022-07-22T22:35:48Z,2022-07-31T17:00:14Z,8,12,MERGED
JabRefOnline,Fix CORS for API,https://github.com/JabRef/JabRefOnline/pull/1242,2022-07-22T17:34:42Z,2022-07-22T21:58:56Z,4,5,MERGED
JabRefOnline,Fix azure deployment urls,https://github.com/JabRef/JabRefOnline/pull/1241,2022-07-22T14:43:05Z,2022-07-22T14:48:47Z,1,1,MERGED
JabRefOnline,Deploy to named enviroments on azure,https://github.com/JabRef/JabRefOnline/pull/1240,2022-07-22T13:59:26Z,2022-07-22T14:13:23Z,3,9,MERGED
JabRefOnline,Split CI workflow in lint and build/test,https://github.com/JabRef/JabRefOnline/pull/1239,2022-07-22T12:52:23Z,2022-07-22T13:11:50Z,4,5,MERGED
JabRefOnline,Migrate to h3 server,https://github.com/JabRef/JabRefOnline/pull/1238,2022-07-19T17:02:40Z,2022-07-20T15:20:18Z,4,6,MERGED
JabRefOnline,gitpod: Improve config for hmr,https://github.com/JabRef/JabRefOnline/pull/1237,2022-07-19T13:39:20Z,2022-07-19T14:35:27Z,3,8,MERGED
JabRefOnline,Fix azure function,https://github.com/JabRef/JabRefOnline/pull/1236,2022-07-18T19:17:29Z,2022-07-19T14:09:43Z,2,5,MERGED
JabRefOnline,Fix Azure deployment workflow,https://github.com/JabRef/JabRefOnline/pull/1235,2022-07-14T16:45:21Z,2022-07-14T17:17:39Z,0,3,MERGED
JabRefOnline,Use pull_request_target to make secrets available to dependabot,https://github.com/JabRef/JabRefOnline/pull/1233,2022-07-14T16:21:50Z,2022-07-14T16:31:35Z,0,2,MERGED
JabRefOnline,Bounded cache,https://github.com/JabRef/JabRefOnline/pull/1212,2022-07-13T18:19:28Z,2022-07-13T18:25:06Z,1,6,MERGED
JabRefOnline,Load graphql schema as virtual module,https://github.com/JabRef/JabRefOnline/pull/1211,2022-07-11T21:47:33Z,2022-07-13T18:16:03Z,2,4,MERGED
JabRefOnline,Deploy api/server on Azure,https://github.com/JabRef/JabRefOnline/pull/1210,2022-07-11T16:45:49Z,2022-07-11T18:07:54Z,4,5,MERGED
JabRefOnline,Update package lock file,https://github.com/JabRef/JabRefOnline/pull/1209,2022-07-06T21:38:10Z,2022-07-10T21:42:28Z,3,5,MERGED
JabRefOnline,Remove exlicit mdx dependency,https://github.com/JabRef/JabRefOnline/pull/1208,2022-07-05T09:52:04Z,2022-07-05T09:58:03Z,0,1,MERGED
JabRefOnline,Dependabot: check for updates only once a month,https://github.com/JabRef/JabRefOnline/pull/1207,2022-07-02T12:46:08Z,2022-07-02T12:53:52Z,0,1,MERGED
JabRefOnline,chore: add sponsor button,https://github.com/JabRef/JabRefOnline/pull/1550,2022-10-27T07:51:15Z,2022-10-27T07:56:26Z,0,1,MERGED
JabRefOnline,"feat: implement persons (authors, editors, ...) following CSL standard",https://github.com/JabRef/JabRefOnline/pull/1549,2022-10-24T20:59:44Z,2022-10-25T10:39:44Z,0,2,MERGED
JabRefOnline,feat: add revision info to changes,https://github.com/JabRef/JabRefOnline/pull/1547,2022-10-21T15:19:32Z,2022-10-21T15:28:56Z,0,1,MERGED
JabRefOnline,chore: use built-in nuxt redirect feature,https://github.com/JabRef/JabRefOnline/pull/1543,2022-10-19T19:17:35Z,2022-10-19T19:27:43Z,0,1,MERGED
JabRefOnline,fix: disable automatically generated anchor links in rendered markdown docs,https://github.com/JabRef/JabRefOnline/pull/1542,2022-10-19T16:58:46Z,2022-10-19T19:41:30Z,0,5,MERGED
JabRefOnline,chore: enable eslint for vue files,https://github.com/JabRef/JabRefOnline/pull/1529,2022-10-16T11:52:51Z,2022-10-16T14:11:20Z,0,3,MERGED
JabRefOnline,chore: upgrade nuxt/tailwindcss patch,https://github.com/JabRef/JabRefOnline/pull/1528,2022-10-16T10:41:17Z,2022-10-16T13:08:14Z,0,2,MERGED
JabRefOnline,chore: remove explicit babel dependency,https://github.com/JabRef/JabRefOnline/pull/1527,2022-10-16T10:21:54Z,2022-10-16T10:33:34Z,0,1,MERGED
JabRefOnline,chore: migrate from jest eslint plugin to vitest,https://github.com/JabRef/JabRefOnline/pull/1526,2022-10-16T10:19:29Z,2022-10-16T11:10:21Z,0,3,MERGED
JabRefOnline,chore: use new apollo server integration package,https://github.com/JabRef/JabRefOnline/pull/1524,2022-10-16T09:53:04Z,2022-10-19T21:27:51Z,0,7,MERGED
JabRefOnline,chore: migrate to apollo server v4,https://github.com/JabRef/JabRefOnline/pull/1513,2022-10-13T22:58:06Z,2022-10-14T14:02:45Z,0,7,MERGED
JabRefOnline,[test] run github test only if token present,https://github.com/JabRef/JabRefOnline/pull/1496,2022-10-13T14:37:12Z,2022-10-13T14:45:00Z,0,1,MERGED
JabRefOnline,feat: implement sync protocol - pull,https://github.com/JabRef/JabRefOnline/pull/1481,2022-10-10T20:53:25Z,2022-10-11T20:52:07Z,0,6,MERGED
JabRefOnline,fix: center top navigation,https://github.com/JabRef/JabRefOnline/pull/1480,2022-10-10T11:48:05Z,2022-10-10T11:59:48Z,0,1,MERGED
JabRefOnline,fix: use correct 'org' domain instead of 'de' for test data,https://github.com/JabRef/JabRefOnline/pull/1479,2022-10-09T22:42:13Z,2022-10-09T23:46:43Z,0,2,MERGED
JabRefOnline,docs: add url for login,https://github.com/JabRef/JabRefOnline/pull/1478,2022-10-09T22:39:05Z,2022-10-09T22:50:09Z,0,1,MERGED
JabRefOnline,feat: improve mobile design,https://github.com/JabRef/JabRefOnline/pull/1472,2022-10-05T11:15:13Z,2022-10-05T11:35:05Z,0,1,MERGED
JabRefOnline,chore: internalize links to blog and download,https://github.com/JabRef/JabRefOnline/pull/1471,2022-10-04T19:22:48Z,2022-10-04T19:31:55Z,0,1,MERGED
JabRefOnline,fix: unify color scheme,https://github.com/JabRef/JabRefOnline/pull/1470,2022-10-04T18:26:49Z,2022-10-04T18:36:57Z,0,1,MERGED
JabRefOnline,chore: import blog,https://github.com/JabRef/JabRefOnline/pull/1469,2022-10-03T18:15:07Z,2022-10-04T09:44:32Z,0,255,MERGED
JabRefOnline,chore: fix typo in deploy workflow,https://github.com/JabRef/JabRefOnline/pull/1468,2022-10-03T18:00:10Z,2022-10-03T18:00:39Z,0,3,MERGED
JabRefOnline,chore: fix timeout of e2e tests on azure,https://github.com/JabRef/JabRefOnline/pull/1466,2022-10-03T17:45:32Z,2022-10-03T17:46:18Z,0,1,MERGED
JabRefOnline,chore: migrate from postman to supertest for e2e api tests,https://github.com/JabRef/JabRefOnline/pull/1463,2022-10-02T22:43:26Z,2022-10-03T00:22:45Z,0,5,MERGED
JabRefOnline,feat: add direct links to downloads,https://github.com/JabRef/JabRefOnline/pull/1460,2022-10-01T23:02:05Z,2022-10-03T16:44:23Z,0,16,MERGED
JabRefOnline,chore: remove explicit server api config,https://github.com/JabRef/JabRefOnline/pull/1459,2022-10-01T16:24:18Z,2022-10-19T19:58:50Z,0,5,MERGED
JabRefOnline,feat: improve nav bar on landing page,https://github.com/JabRef/JabRefOnline/pull/1443,2022-09-27T19:57:01Z,2022-09-27T20:08:06Z,0,1,MERGED
JabRefOnline,feat: change theme to JabRef colors,https://github.com/JabRef/JabRefOnline/pull/1442,2022-09-27T11:49:20Z,2022-09-27T11:59:59Z,0,1,MERGED
JabRefOnline,chore: replace naive-ui module with external module,https://github.com/JabRef/JabRefOnline/pull/1441,2022-09-27T10:44:00Z,2022-09-27T10:54:19Z,0,1,MERGED
JabRefOnline,feat: add redirects for backwards compatibility,https://github.com/JabRef/JabRefOnline/pull/1439,2022-09-23T22:36:45Z,2022-09-24T11:16:05Z,0,3,MERGED
JabRefOnline,feat: add client-side validation to login,https://github.com/JabRef/JabRefOnline/pull/1438,2022-09-23T16:37:10Z,2022-09-23T16:51:30Z,0,2,MERGED
JabRefOnline,feat: add input validation for graphql backend,https://github.com/JabRef/JabRefOnline/pull/1437,2022-09-21T22:30:11Z,2022-09-22T13:53:25Z,0,3,MERGED
JabRefOnline,chore: change ts-ignore to ts-expect-error,https://github.com/JabRef/JabRefOnline/pull/1436,2022-09-21T11:24:37Z,2022-09-21T12:17:16Z,0,4,MERGED
JabRefOnline,chore: start storybook as part of dev server,https://github.com/JabRef/JabRefOnline/pull/1435,2022-09-20T21:43:50Z,2022-09-21T08:07:38Z,0,1,MERGED
JabRefOnline,chore: enable tailwindcss vscode extension,https://github.com/JabRef/JabRefOnline/pull/1434,2022-09-20T12:18:41Z,2022-09-20T13:08:34Z,0,1,MERGED
JabRefOnline,chore: delete obsolete release workflow,https://github.com/JabRef/JabRefOnline/pull/1432,2022-09-20T07:04:02Z,2022-09-20T13:26:16Z,0,3,MERGED
JabRefOnline,chore: specify name for production environment,https://github.com/JabRef/JabRefOnline/pull/1431,2022-09-20T07:02:13Z,2022-09-20T07:10:50Z,0,1,MERGED
JabRefOnline,chore: reduce sleep timeout after api deploy,https://github.com/JabRef/JabRefOnline/pull/1430,2022-09-19T12:54:43Z,2022-09-19T12:56:46Z,0,1,MERGED
JabRefOnline,fix: fix login on azure,https://github.com/JabRef/JabRefOnline/pull/1429,2022-09-18T19:05:35Z,2022-09-19T20:43:32Z,0,12,MERGED
JabRefOnline,chore!: improve graphql eslint config and fix issues,https://github.com/JabRef/JabRefOnline/pull/1428,2022-09-18T16:24:35Z,2022-09-18T20:13:55Z,0,4,MERGED
JabRefOnline,chore: delete function app after PR is closed,https://github.com/JabRef/JabRefOnline/pull/1427,2022-09-17T17:56:52Z,2022-09-17T18:01:05Z,0,1,MERGED
JabRefOnline,chore: run azure functions from package file,https://github.com/JabRef/JabRefOnline/pull/1426,2022-09-17T16:51:24Z,2022-09-18T18:56:14Z,1,2,MERGED
JabRefOnline,chore: pin lru-cache at v6,https://github.com/JabRef/JabRefOnline/pull/1425,2022-09-17T16:31:04Z,2022-09-17T17:21:44Z,0,1,MERGED
JabRefOnline,chore: manually deploy to azure,https://github.com/JabRef/JabRefOnline/pull/1424,2022-09-17T15:23:31Z,2022-09-17T15:30:32Z,0,1,MERGED
JabRefOnline,chore: run deploy workflow on windows,https://github.com/JabRef/JabRefOnline/pull/1423,2022-09-17T14:03:52Z,2022-09-17T14:08:32Z,1,1,MERGED
JabRefOnline,chore: use 64bit version of node on azure,https://github.com/JabRef/JabRefOnline/pull/1422,2022-09-17T13:13:25Z,2022-09-17T14:07:39Z,3,4,MERGED
JabRefOnline,chore: replace http status check by simple sleep,https://github.com/JabRef/JabRefOnline/pull/1421,2022-09-17T13:08:48Z,2022-09-17T13:14:38Z,1,1,MERGED
JabRefOnline,chore: fix cors headers,https://github.com/JabRef/JabRefOnline/pull/1420,2022-09-17T10:13:26Z,2022-09-17T11:53:09Z,4,5,MERGED
JabRefOnline,chore: fix environment name during deploy,https://github.com/JabRef/JabRefOnline/pull/1419,2022-09-16T20:48:08Z,2022-09-16T20:57:46Z,0,2,MERGED
JabRefOnline,chore: fix deploy workflow,https://github.com/JabRef/JabRefOnline/pull/1418,2022-09-16T20:33:38Z,2022-09-16T20:38:22Z,0,1,MERGED
JabRefOnline,chore: migrate to bring your own azure function app,https://github.com/JabRef/JabRefOnline/pull/1417,2022-09-16T20:11:42Z,2022-09-16T20:28:08Z,3,2,MERGED
JabRefOnline,chore: start using Conventional Commits,https://github.com/JabRef/JabRefOnline/pull/1414,2022-09-15T19:18:14Z,2022-09-15T19:26:21Z,1,4,MERGED
JabRefOnline,chore: add graphql client identification,https://github.com/JabRef/JabRefOnline/pull/1413,2022-09-15T17:54:42Z,2022-09-15T18:02:05Z,1,1,MERGED
JabRefOnline,fix: also show feature pictures in production,https://github.com/JabRef/JabRefOnline/pull/1412,2022-09-15T13:35:23Z,2022-09-15T13:45:23Z,1,1,MERGED
JabRefOnline,Use fragment masking,https://github.com/JabRef/JabRefOnline/pull/1411,2022-09-15T12:20:37Z,2022-09-15T12:27:42Z,2,1,MERGED
JabRefOnline,chore: update lock file and upgrade to nuxt rc 11,https://github.com/JabRef/JabRefOnline/pull/1410,2022-09-15T10:20:35Z,2022-09-21T11:25:52Z,3,8,MERGED
JabRefOnline,Revise apollo-server,https://github.com/JabRef/JabRefOnline/pull/1409,2022-09-15T10:01:01Z,2022-09-15T10:09:20Z,1,1,MERGED
JabRefOnline,Migrate from jest to vitest,https://github.com/JabRef/JabRefOnline/pull/1408,2022-09-14T14:53:53Z,2022-09-14T16:54:04Z,6,6,MERGED
JabRefOnline,Fix prerendering of routes in azure,https://github.com/JabRef/JabRefOnline/pull/1407,2022-09-13T20:55:35Z,2022-09-13T21:09:43Z,1,2,MERGED
JabRefOnline,Fix tailwind autocompletion vscode extension,https://github.com/JabRef/JabRefOnline/pull/1406,2022-09-13T19:59:21Z,2022-09-20T12:20:40Z,3,1,CLOSED
JabRefOnline,fix: increase size of download button,https://github.com/JabRef/JabRefOnline/pull/1405,2022-09-13T19:50:33Z,2022-09-20T15:19:45Z,2,4,MERGED
JabRefOnline,Remove workaround for index page of surveys,https://github.com/JabRef/JabRefOnline/pull/1404,2022-09-13T17:55:34Z,2022-09-13T18:39:26Z,2,2,MERGED
JabRefOnline,Remove obsolete deploy steps,https://github.com/JabRef/JabRefOnline/pull/1388,2022-09-11T17:03:34Z,2022-09-11T17:21:32Z,2,2,MERGED
JabRefOnline,Display maintainers in a popover,https://github.com/JabRef/JabRefOnline/pull/1376,2022-09-09T21:21:12Z,2022-09-09T21:27:12Z,1,1,MERGED
JabRefOnline,Fix storybook dev command,https://github.com/JabRef/JabRefOnline/pull/1374,2022-09-09T16:26:48Z,2022-09-09T16:34:21Z,1,1,MERGED
JabRefOnline,Migrate to naive-ui,https://github.com/JabRef/JabRefOnline/pull/1373,2022-09-08T21:12:13Z,2022-09-09T17:02:21Z,9,2,MERGED
JabRefOnline,Remove obsolete yarn resolutions,https://github.com/JabRef/JabRefOnline/pull/1372,2022-09-07T11:31:53Z,2022-09-07T11:40:09Z,2,2,MERGED
JabRefOnline,Remove old express server stuff,https://github.com/JabRef/JabRefOnline/pull/1371,2022-09-07T11:16:39Z,2022-09-07T11:25:19Z,1,1,MERGED
JabRefOnline,Dependabot fix: don't run install scripts,https://github.com/JabRef/JabRefOnline/pull/1370,2022-09-04T11:52:43Z,2022-09-04T12:11:17Z,1,1,MERGED
JabRefOnline,Automatically allow PRs by known parties to deploy,https://github.com/JabRef/JabRefOnline/pull/1365,2022-09-03T21:13:54Z,2022-09-04T07:24:46Z,3,2,MERGED
JabRefOnline,Introduce type for redis client,https://github.com/JabRef/JabRefOnline/pull/1351,2022-09-02T21:54:16Z,2022-09-02T22:01:52Z,1,1,MERGED
JabRefOnline,Add ForestAdmin dashboard,https://github.com/JabRef/JabRefOnline/pull/1345,2022-08-29T22:37:32Z,2023-03-03T14:29:07Z,3,8,CLOSED
JabRefOnline,Use graphql-codegen-esm,https://github.com/JabRef/JabRefOnline/pull/1344,2022-08-29T21:23:50Z,2022-08-29T21:30:21Z,1,1,MERGED
