repo_name,pr_title,pr_url,created_at,closed_at,total_comments,total_commits,state
paragon,fix(asinput): proptype validation to include both func and obj,https://github.com/openedx/paragon/pull/500,2019-07-31T14:11:27Z,2019-07-31T18:38:17Z,3,3,MERGED
paragon,fix(searchfield): small fix for searchfield focus and style,https://github.com/openedx/paragon/pull/499,2019-07-30T20:13:42Z,2019-07-30T21:58:17Z,2,2,MERGED
paragon,feat: remove roboto from theme scss,https://github.com/openedx/paragon/pull/498,2019-07-24T19:20:16Z,2019-07-24T20:04:08Z,3,1,MERGED
paragon,fix: modal to not close when mouse drag from in modal to out,https://github.com/openedx/paragon/pull/497,2019-07-23T15:26:40Z,2019-07-23T18:22:27Z,2,2,MERGED
paragon,style: remove browser default clear input search,https://github.com/openedx/paragon/pull/496,2019-07-19T21:49:05Z,2019-07-24T17:05:56Z,3,3,MERGED
paragon,fix: do not set a default id for Icon component,https://github.com/openedx/paragon/pull/495,2019-07-15T07:59:49Z,2019-07-18T15:46:25Z,9,1,MERGED
paragon,feat: major refactor of collapsible component,https://github.com/openedx/paragon/pull/494,2019-07-11T21:36:12Z,2019-08-20T18:41:57Z,5,6,CLOSED
paragon,Add treeshaking documentation.,https://github.com/openedx/paragon/pull/493,2019-07-03T18:15:08Z,2019-07-03T18:35:10Z,2,1,MERGED
paragon,build: tighten up dist directory,https://github.com/openedx/paragon/pull/492,2019-07-03T16:17:20Z,2019-07-05T12:25:13Z,2,1,MERGED
paragon,docs: add spacing documentation,https://github.com/openedx/paragon/pull/491,2019-07-03T14:40:39Z,2019-07-03T18:54:29Z,3,2,MERGED
paragon,docs: add layout documentation,https://github.com/openedx/paragon/pull/490,2019-07-02T21:29:41Z,2019-07-03T18:54:11Z,5,2,MERGED
paragon,refactor: fix tabsui,https://github.com/openedx/paragon/pull/489,2019-07-02T17:31:30Z,2019-07-03T20:12:04Z,6,5,MERGED
paragon,feat: add color system and color docs,https://github.com/openedx/paragon/pull/488,2019-07-02T17:17:34Z,2019-07-03T16:51:27Z,12,5,MERGED
paragon,refactor: fix ui of tabs,https://github.com/openedx/paragon/pull/487,2019-07-02T17:03:41Z,2019-07-02T17:59:04Z,0,1,CLOSED
paragon,fix: add bootstrap as dependency,https://github.com/openedx/paragon/pull/486,2019-07-02T16:33:07Z,2019-07-02T17:01:32Z,2,1,MERGED
paragon,refactor: fix tabs border,https://github.com/openedx/paragon/pull/485,2019-07-02T16:24:21Z,2019-07-02T16:55:50Z,0,18,CLOSED
paragon,fix: include scss files in dist,https://github.com/openedx/paragon/pull/482,2019-07-01T13:13:08Z,2019-07-01T13:22:48Z,3,1,MERGED
paragon,"Revert ""revert(treeshaking): wanted a breaking change""",https://github.com/openedx/paragon/pull/481,2019-06-28T20:01:37Z,2019-06-28T20:03:44Z,2,1,MERGED
paragon,revert(treeshaking): wanted a breaking change,https://github.com/openedx/paragon/pull/480,2019-06-28T19:57:29Z,2019-06-28T20:01:03Z,2,1,MERGED
paragon,build(treeshaking): export es6 modules so the can be treeshook,https://github.com/openedx/paragon/pull/479,2019-06-28T19:10:33Z,2019-06-28T19:53:46Z,9,1,MERGED
paragon,docs: add typography to doc site,https://github.com/openedx/paragon/pull/478,2019-06-26T16:13:53Z,2019-06-26T19:03:28Z,3,3,MERGED
paragon,docs: add CSS utility classes to doc pages,https://github.com/openedx/paragon/pull/476,2019-06-21T22:06:26Z,2019-06-24T17:57:34Z,6,3,MERGED
paragon,fix: include scss folder in published package,https://github.com/openedx/paragon/pull/475,2019-06-20T22:07:19Z,2019-06-21T14:19:14Z,2,1,MERGED
paragon,docs: remove interactive modal breaking gatsby build,https://github.com/openedx/paragon/pull/474,2019-06-20T20:25:49Z,2019-06-20T20:40:47Z,2,1,MERGED
paragon,docs: add status page,https://github.com/openedx/paragon/pull/473,2019-06-20T19:30:00Z,2019-06-20T20:10:24Z,5,2,MERGED
paragon,docs: add pages with interactive code blocks,https://github.com/openedx/paragon/pull/472,2019-06-20T14:21:48Z,2019-06-20T19:40:51Z,3,8,MERGED
paragon,feat: add scss core to project,https://github.com/openedx/paragon/pull/471,2019-06-19T14:54:18Z,2019-06-20T21:44:20Z,2,4,MERGED
paragon,docs: basic layout and navigation for doc site,https://github.com/openedx/paragon/pull/470,2019-06-19T14:28:22Z,2019-06-20T16:01:34Z,1,1,CLOSED
paragon,docs: basic layout and nav for doc site,https://github.com/openedx/paragon/pull/469,2019-06-18T20:13:57Z,2019-06-19T14:28:25Z,4,1,CLOSED
paragon,feat: add scss core and move existing paragon scss into it,https://github.com/openedx/paragon/pull/468,2019-06-18T15:35:41Z,2019-06-19T14:51:28Z,1,4,CLOSED
paragon,docs: fix build and deployment of doc site,https://github.com/openedx/paragon/pull/467,2019-06-13T20:27:26Z,2019-06-13T20:35:50Z,3,3,MERGED
paragon,docs: fix storybook deployment,https://github.com/openedx/paragon/pull/466,2019-06-13T18:02:43Z,2019-06-13T18:07:50Z,2,1,MERGED
paragon,Initial documentation site using gatsby and mdx,https://github.com/openedx/paragon/pull/465,2019-06-12T20:39:27Z,2019-06-13T17:32:27Z,4,5,MERGED
paragon,Update to tests and Shift + Tab key handling,https://github.com/openedx/paragon/pull/464,2019-06-12T15:54:53Z,2019-06-12T18:55:54Z,0,6,MERGED
paragon,feat: use babel instead of webpack for build,https://github.com/openedx/paragon/pull/461,2019-06-07T19:45:20Z,2019-07-02T17:02:25Z,4,2,CLOSED
paragon,add semantic release config,https://github.com/openedx/paragon/pull/459,2019-06-06T20:17:29Z,2019-06-06T20:24:51Z,3,1,MERGED
paragon,fix: successfully merge refs in Input,https://github.com/openedx/paragon/pull/458,2019-06-06T19:53:14Z,2019-06-06T20:28:46Z,2,1,MERGED
paragon,Ekii/status alert refactor,https://github.com/openedx/paragon/pull/457,2019-06-06T18:01:37Z,2019-06-10T18:25:31Z,4,13,MERGED
paragon,ekii/Tabs Refactor,https://github.com/openedx/paragon/pull/454,2019-06-04T14:40:00Z,2019-06-10T18:22:52Z,16,16,MERGED
paragon,Ekii/tabs refactor,https://github.com/openedx/paragon/pull/453,2019-06-04T13:33:37Z,2019-06-04T14:42:24Z,1,4,CLOSED
paragon,Refactor Dropdown,https://github.com/openedx/paragon/pull/452,2019-06-03T21:29:20Z,2019-06-28T19:36:11Z,24,7,MERGED
paragon,fix(a11y): ensure close button gets an id and is referenced properly,https://github.com/openedx/paragon/pull/524,2019-10-02T13:30:22Z,2019-10-02T15:56:49Z,2,1,MERGED
paragon,fix: update field validation style,https://github.com/openedx/paragon/pull/521,2019-09-19T13:48:21Z,2019-09-27T14:04:24Z,2,4,MERGED
paragon,docs: add sketch library link to docsite,https://github.com/openedx/paragon/pull/520,2019-09-17T21:43:12Z,2019-09-18T13:34:35Z,2,1,MERGED
paragon,fix: remove react from dependencies. Addback to peer/dev dependencies,https://github.com/openedx/paragon/pull/519,2019-09-09T19:05:46Z,2019-09-16T14:56:42Z,2,1,MERGED
paragon,fix: remove postinstall hook for doc site,https://github.com/openedx/paragon/pull/516,2019-08-27T19:08:38Z,2019-08-28T13:13:08Z,2,1,MERGED
paragon,build: re-add tokens to travis.yml,https://github.com/openedx/paragon/pull/515,2019-08-27T13:17:57Z,2019-08-27T14:58:08Z,2,1,MERGED
paragon,build: update travis doc site deployment and remove cruft,https://github.com/openedx/paragon/pull/513,2019-08-26T21:41:47Z,2019-08-27T13:08:16Z,2,2,MERGED
paragon,fix: deploy builds gatsby site first,https://github.com/openedx/paragon/pull/512,2019-08-26T16:35:19Z,2019-08-26T16:46:26Z,2,1,MERGED
paragon,fix: update deploy scripts and remove webpack config,https://github.com/openedx/paragon/pull/511,2019-08-23T21:18:19Z,2019-08-26T13:49:28Z,1,1,MERGED
paragon,feat: delete storybook,https://github.com/openedx/paragon/pull/510,2019-08-23T21:01:48Z,2019-08-26T14:40:24Z,4,1,MERGED
paragon,fix: update npm version in travis.yml,https://github.com/openedx/paragon/pull/509,2019-08-23T15:44:53Z,2019-08-23T15:47:47Z,2,1,MERGED
paragon,fix: onToggle send the new state to callback instead of dirty state,https://github.com/openedx/paragon/pull/508,2019-08-22T20:29:26Z,2019-08-23T15:32:32Z,2,2,MERGED
paragon,Update travis.yml to use latest LTS version of node,https://github.com/openedx/paragon/pull/507,2019-08-22T15:52:41Z,2019-08-22T18:43:42Z,2,2,MERGED
paragon,Add component status and proptype descriptions,https://github.com/openedx/paragon/pull/506,2019-08-16T19:05:36Z,2019-08-23T15:32:03Z,3,1,MERGED
paragon,feat: Collapsible Component,https://github.com/openedx/paragon/pull/504,2019-08-08T20:37:32Z,2019-08-20T19:58:18Z,4,16,MERGED
paragon,fix: modal can accept any react component for buttons,https://github.com/openedx/paragon/pull/503,2019-08-07T19:22:24Z,2019-08-07T19:27:49Z,2,1,MERGED
paragon,fix: input focus color now accessible,https://github.com/openedx/paragon/pull/502,2019-08-07T16:16:16Z,2019-08-12T13:14:58Z,2,1,MERGED
paragon,fix(prop-types): use PropTypes.element instead of Element,https://github.com/openedx/paragon/pull/501,2019-08-01T19:28:22Z,2019-08-01T19:39:27Z,3,1,MERGED
paragon,Update renovate.json,https://github.com/openedx/paragon/pull/527,2019-12-04T19:37:17Z,2020-04-21T18:45:03Z,2,1,MERGED
paragon,[WIP] refactor: modal,https://github.com/openedx/paragon/pull/526,2019-12-02T15:45:02Z,2021-02-11T18:07:39Z,0,5,CLOSED
paragon,feat: export collapsible context,https://github.com/openedx/paragon/pull/525,2019-11-07T20:19:33Z,2019-11-07T20:24:31Z,2,1,MERGED
paragon,fix: ignore deprecation warnings for bootstrap v5,https://github.com/openedx/paragon/pull/532,2020-03-24T21:25:45Z,2020-03-24T21:36:17Z,2,2,MERGED
paragon,"fix(searchfield): remove browser ""X"" icon",https://github.com/openedx/paragon/pull/541,2020-05-01T17:03:22Z,2020-05-01T19:29:46Z,2,1,MERGED
paragon,feat(searchfield): refactor SearchField component,https://github.com/openedx/paragon/pull/540,2020-04-27T12:16:53Z,2020-05-01T14:08:53Z,12,3,MERGED
paragon,"WIP: Upgrade paragon to use frontend-build for jest, babel, and linting",https://github.com/openedx/paragon/pull/539,2020-04-13T17:15:12Z,2021-06-10T15:03:21Z,0,1,CLOSED
paragon,fix: remove edx bootstrap from dependencies,https://github.com/openedx/paragon/pull/538,2020-04-09T17:31:42Z,2020-04-09T17:46:42Z,2,1,MERGED
paragon,fix: overriding media query,https://github.com/openedx/paragon/pull/536,2020-04-09T16:11:59Z,2020-04-09T18:12:55Z,3,4,MERGED
paragon,Swang/update docs,https://github.com/openedx/paragon/pull/535,2020-04-07T20:19:08Z,2020-04-08T13:20:21Z,2,3,MERGED
paragon,Updating pagination component,https://github.com/openedx/paragon/pull/534,2020-04-06T19:46:16Z,2020-04-07T14:46:17Z,7,7,MERGED
paragon,Update max container width (per design team),https://github.com/openedx/paragon/pull/533,2020-04-06T13:19:47Z,2020-04-06T13:55:28Z,2,1,MERGED
paragon,fix: remove transparent outline rule for inputs,https://github.com/openedx/paragon/pull/552,2020-07-30T21:38:41Z,2020-07-30T21:45:30Z,2,1,MERGED
paragon,docs: update layout docs,https://github.com/openedx/paragon/pull/551,2020-07-17T16:28:20Z,2020-07-17T16:50:20Z,3,3,MERGED
paragon,feat: add accessible react-bootstrap components,https://github.com/openedx/paragon/pull/550,2020-07-15T17:05:40Z,2020-07-17T15:44:29Z,13,22,MERGED
paragon,fix(searchfield): update state value when prop value changes,https://github.com/openedx/paragon/pull/545,2020-06-27T11:01:47Z,2020-06-30T16:57:16Z,2,1,MERGED
paragon,Adopt react-bootstrap ADR,https://github.com/openedx/paragon/pull/544,2020-06-26T15:15:31Z,2020-07-15T15:14:29Z,15,15,MERGED
paragon,fix: toast styling,https://github.com/openedx/paragon/pull/583,2020-10-23T13:48:26Z,2020-10-23T13:54:35Z,2,1,MERGED
paragon,fix(modal): downgrade tabbable to avoid es5 transpilation issue,https://github.com/openedx/paragon/pull/580,2020-10-07T15:59:00Z,2020-10-07T16:04:14Z,2,1,MERGED
paragon,fix(iconButton): background-color white,https://github.com/openedx/paragon/pull/579,2020-10-07T15:45:58Z,2020-10-07T15:52:35Z,2,1,MERGED
paragon,[DO NOT MERGE] docs: add prospectus color mapping,https://github.com/openedx/paragon/pull/578,2020-10-02T17:46:15Z,2021-01-14T15:23:45Z,1,3,CLOSED
paragon,fix(modal): focus trapping with `react-focus-on` and `tabbable`,https://github.com/openedx/paragon/pull/577,2020-10-01T11:43:06Z,2020-10-01T17:10:52Z,10,3,MERGED
paragon,fix(modal): renderDefaultCloseButton option,https://github.com/openedx/paragon/pull/576,2020-09-28T16:00:10Z,2020-09-28T16:05:04Z,2,1,MERGED
paragon,style(modal): add renderDefaultCloseButton option,https://github.com/openedx/paragon/pull/575,2020-09-24T16:55:43Z,2020-09-24T21:05:45Z,4,4,MERGED
paragon,Remove edx.org theme from docs,https://github.com/openedx/paragon/pull/573,2020-09-18T20:32:21Z,2020-09-21T20:11:28Z,7,10,MERGED
paragon,WIP: Remove edx theme from doc site,https://github.com/openedx/paragon/pull/572,2020-09-18T20:22:45Z,2020-09-18T20:31:31Z,1,10,CLOSED
paragon,WIP: Remove edx theme from documentation site,https://github.com/openedx/paragon/pull/571,2020-09-18T20:20:21Z,2020-09-18T20:20:45Z,2,10,CLOSED
paragon,docs: make modal documentation interactive,https://github.com/openedx/paragon/pull/570,2020-09-18T13:50:30Z,2021-01-14T15:23:54Z,0,3,CLOSED
paragon,fix(icon-button): remove tooltip and add alt text,https://github.com/openedx/paragon/pull/569,2020-09-14T16:51:37Z,2020-09-15T14:41:26Z,2,1,MERGED
paragon,docs(buttons): use variant prop for buttons in live code snippets,https://github.com/openedx/paragon/pull/568,2020-09-10T22:00:38Z,2020-09-11T13:15:14Z,3,1,MERGED
paragon,feat: add support for FormControl,https://github.com/openedx/paragon/pull/567,2020-09-09T20:18:33Z,2020-09-09T20:45:00Z,2,1,MERGED
paragon,docs: add latest version number to doc landing,https://github.com/openedx/paragon/pull/566,2020-09-02T21:54:19Z,2020-09-02T22:01:14Z,2,1,MERGED
paragon,feat: update toast component styling,https://github.com/openedx/paragon/pull/565,2020-09-02T13:45:32Z,2020-09-08T14:52:58Z,8,1,MERGED
paragon,docs: add netlify open source plan requirements to documentation,https://github.com/openedx/paragon/pull/564,2020-08-28T14:05:05Z,2020-08-28T15:12:00Z,2,1,MERGED
paragon,fix: update eslint to @edx/eslint-config,https://github.com/openedx/paragon/pull/560,2020-08-24T15:27:29Z,2020-08-27T20:52:15Z,7,1,MERGED
paragon,feat: adding className pass-through to .modal-dialog element,https://github.com/openedx/paragon/pull/559,2020-08-21T17:10:27Z,2020-08-21T17:17:28Z,4,1,MERGED
paragon,docs: add adr for removal of edx assets,https://github.com/openedx/paragon/pull/558,2020-08-14T20:27:01Z,2020-08-19T15:10:18Z,4,4,MERGED
paragon,Improve developer documentation in readme,https://github.com/openedx/paragon/pull/557,2020-08-13T12:57:07Z,2020-08-13T14:19:03Z,3,7,MERGED
paragon,docs: upgrade gatsby-mdx to gatsby-plugin-mdx and fix console warnings,https://github.com/openedx/paragon/pull/556,2020-08-12T22:54:45Z,2020-08-12T23:01:04Z,5,4,MERGED
paragon,Icon button,https://github.com/openedx/paragon/pull/555,2020-08-12T21:41:51Z,2020-08-21T17:52:47Z,18,7,MERGED
paragon,fix: update the usage of button internal to Table,https://github.com/openedx/paragon/pull/554,2020-08-07T19:38:31Z,2020-08-07T20:44:56Z,2,1,MERGED
paragon,"feat: add button, dropdown, and tabs from react-bootstrap",https://github.com/openedx/paragon/pull/553,2020-08-03T20:54:30Z,2020-08-04T19:27:16Z,9,6,MERGED
paragon,feat: deprecate previous Breadcrumb for react-bootstrap implementation,https://github.com/openedx/paragon/pull/599,2020-12-19T18:32:13Z,2020-12-19T18:50:35Z,2,1,CLOSED
paragon,Table components,https://github.com/openedx/paragon/pull/598,2020-12-16T20:27:25Z,2021-01-15T14:52:59Z,42,78,MERGED
paragon,docs: deprecate checkboxgroup and radiobuttongroup,https://github.com/openedx/paragon/pull/596,2020-12-09T22:26:56Z,2020-12-09T23:20:32Z,2,3,MERGED
paragon,fix: setting container-xl max-width to 1600px,https://github.com/openedx/paragon/pull/595,2020-12-09T20:51:55Z,2020-12-09T20:56:40Z,2,1,MERGED
paragon,docs: fix color docs,https://github.com/openedx/paragon/pull/594,2020-12-08T21:09:45Z,2020-12-09T00:54:41Z,2,2,MERGED
paragon,feat: add avatar and avatar button,https://github.com/openedx/paragon/pull/593,2020-12-07T22:01:00Z,2020-12-09T17:00:12Z,2,9,MERGED
paragon,fix: update style of buttons in toast,https://github.com/openedx/paragon/pull/592,2020-12-04T18:48:57Z,2020-12-04T19:42:42Z,6,4,MERGED
paragon,feat: add inverse variants of buttons,https://github.com/openedx/paragon/pull/591,2020-12-03T20:58:54Z,2020-12-03T21:14:29Z,3,1,MERGED
paragon,fix: no longer override theme color level definitions,https://github.com/openedx/paragon/pull/590,2020-12-03T17:26:16Z,2020-12-03T17:31:26Z,2,1,MERGED
paragon,docs: use brand-edx.org theme for themed doc site,https://github.com/openedx/paragon/pull/589,2020-12-01T15:19:39Z,2020-12-01T15:39:05Z,2,2,MERGED
paragon,build: use github actions instead of travis ci,https://github.com/openedx/paragon/pull/588,2020-11-30T22:03:43Z,2020-11-30T22:28:23Z,2,5,MERGED
paragon,feat: add brand core color and tertiary buttons,https://github.com/openedx/paragon/pull/587,2020-11-20T21:32:05Z,2020-11-20T22:11:07Z,2,3,MERGED
paragon,feat: add definitions for color variables in Paragon core scss,https://github.com/openedx/paragon/pull/586,2020-11-20T18:03:49Z,2020-11-20T19:54:51Z,2,5,MERGED
paragon,Updated the build status badge to point to travis-ci.com,https://github.com/openedx/paragon/pull/585,2020-11-18T15:16:38Z,2020-12-17T08:46:17Z,1,1,MERGED
paragon,feat: update display font sizes and line heights,https://github.com/openedx/paragon/pull/680,2021-03-31T19:18:34Z,2021-03-31T20:30:57Z,3,3,MERGED
paragon,feat: add Form.Radio and Form.RadioSet,https://github.com/openedx/paragon/pull/678,2021-03-30T16:44:24Z,2021-04-02T22:05:35Z,13,43,MERGED
paragon,fix: reintroduce list group and media css,https://github.com/openedx/paragon/pull/677,2021-03-30T13:00:38Z,2021-03-30T13:36:31Z,2,2,MERGED
paragon,fix: remove rounded corners on SearchField,https://github.com/openedx/paragon/pull/675,2021-03-29T15:22:43Z,2021-12-16T13:38:11Z,2,1,CLOSED
paragon,docs: use latest edx brand theme for edx deploys,https://github.com/openedx/paragon/pull/674,2021-03-24T20:14:54Z,2021-03-24T20:23:11Z,2,1,MERGED
paragon,fix: data-table border styling,https://github.com/openedx/paragon/pull/671,2021-03-24T16:36:47Z,2021-03-24T18:49:39Z,3,1,MERGED
paragon,fix: remove unused sass-loader dependency,https://github.com/openedx/paragon/pull/670,2021-03-24T14:43:14Z,2021-03-24T16:53:17Z,2,1,MERGED
paragon,docs: fix scrollbar display,https://github.com/openedx/paragon/pull/669,2021-03-24T14:15:40Z,2021-03-24T14:37:44Z,2,1,MERGED
paragon,fix: add headerClassName and cellClassName,https://github.com/openedx/paragon/pull/668,2021-03-23T21:13:52Z,2021-03-23T21:54:25Z,3,1,MERGED
paragon,[BD-35] PAR-288 feat: update styles for tabs component according to new design,https://github.com/openedx/paragon/pull/667,2021-03-23T16:06:54Z,2021-06-10T15:05:21Z,3,1,CLOSED
paragon,docs: fix path prefixing for github deployment,https://github.com/openedx/paragon/pull/666,2021-03-23T15:12:12Z,2021-03-23T15:22:09Z,2,1,MERGED
paragon,docs: overhaul doc site and move component readmes to src,https://github.com/openedx/paragon/pull/665,2021-03-20T01:03:31Z,2021-03-22T21:43:03Z,5,38,MERGED
paragon,WIP: doc site overhaul,https://github.com/openedx/paragon/pull/664,2021-03-19T17:58:47Z,2021-03-22T12:51:41Z,0,54,CLOSED
paragon,[BD-35] PAR-291 feat: change alert component according to new design,https://github.com/openedx/paragon/pull/663,2021-03-19T00:57:36Z,2021-03-30T15:04:13Z,4,1,MERGED
paragon,[BD-35] PAR-284 feat: change popover component according to new design,https://github.com/openedx/paragon/pull/662,2021-03-17T21:10:44Z,2021-04-06T14:15:45Z,5,1,MERGED
paragon,[BD-35] PAR-282 feat: change tooltip component according to new design,https://github.com/openedx/paragon/pull/661,2021-03-15T21:32:28Z,2021-04-30T12:44:37Z,8,3,MERGED
paragon,feat: Add form components,https://github.com/openedx/paragon/pull/660,2021-03-12T22:09:50Z,2021-03-19T22:38:12Z,16,38,MERGED
paragon,fix: do not memoize instance,https://github.com/openedx/paragon/pull/659,2021-03-10T14:55:09Z,2021-03-10T15:21:38Z,7,1,MERGED
paragon,[BD-35] PAR-286 feat: change collapsible component according to new design,https://github.com/openedx/paragon/pull/658,2021-03-09T20:56:23Z,2021-03-16T00:51:11Z,5,1,MERGED
paragon,fix: google translate issue with text nodes,https://github.com/openedx/paragon/pull/657,2021-03-08T09:57:55Z,2021-03-08T10:14:47Z,3,1,MERGED
paragon,[BD-35] PAR-280 feat: change styles according to new dropdown component design,https://github.com/openedx/paragon/pull/656,2021-03-04T21:14:09Z,2021-03-15T14:07:58Z,4,1,MERGED
paragon,feat(icons): add 16 icons,https://github.com/openedx/paragon/pull/654,2021-03-04T14:32:09Z,2021-03-04T18:38:21Z,2,1,MERGED
paragon,fix: vertically align breadcrumb spacer with text,https://github.com/openedx/paragon/pull/653,2021-03-04T13:39:05Z,2021-03-04T15:17:28Z,2,1,MERGED
paragon,[BD-35] PAR-285 feat: change styles according to new badge component design,https://github.com/openedx/paragon/pull/652,2021-03-03T21:44:17Z,2021-03-03T21:53:44Z,3,1,MERGED
paragon,[BD-35] PAR-285 feat: change breadcrumb component according to new design,https://github.com/openedx/paragon/pull/651,2021-03-03T21:05:04Z,2021-03-04T01:11:22Z,6,1,MERGED
paragon,fix: update default styles to be less different from edx.org brand,https://github.com/openedx/paragon/pull/650,2021-03-02T21:20:32Z,2021-03-04T13:51:25Z,3,5,MERGED
paragon,ci: add CI check step to preview semantic-release next release version,https://github.com/openedx/paragon/pull/649,2021-03-02T17:41:44Z,2021-03-02T19:21:52Z,3,1,MERGED
paragon,[BD-35] PAR-289 feat: change styles according to new toast component design,https://github.com/openedx/paragon/pull/648,2021-03-02T15:37:18Z,2021-03-02T16:11:37Z,3,1,MERGED
paragon,docs: update mdx docs to use onClose for modal,https://github.com/openedx/paragon/pull/646,2021-03-01T21:59:27Z,2021-03-02T16:13:32Z,3,1,MERGED
paragon,fix: renames close handler to onClose,https://github.com/openedx/paragon/pull/645,2021-03-01T20:58:46Z,2021-03-01T21:16:16Z,2,1,MERGED
paragon,fix: force container sizes to obey max width,https://github.com/openedx/paragon/pull/644,2021-03-01T15:04:47Z,2021-03-02T16:13:49Z,2,1,MERGED
paragon,docs: basic usage insights page,https://github.com/openedx/paragon/pull/643,2021-03-01T14:37:35Z,2021-03-01T15:19:27Z,8,1,MERGED
paragon,fix: change clear selection to sentence case,https://github.com/openedx/paragon/pull/642,2021-02-24T14:43:13Z,2021-02-24T15:16:20Z,2,1,MERGED
paragon,Add dependent usage analyzer,https://github.com/openedx/paragon/pull/641,2021-02-23T23:01:26Z,2021-02-25T16:12:41Z,6,7,MERGED
paragon,feat: Add TableActions component,https://github.com/openedx/paragon/pull/640,2021-02-23T22:27:42Z,2021-02-26T18:59:04Z,14,6,MERGED
paragon,Sheet fixes,https://github.com/openedx/paragon/pull/638,2021-02-18T17:20:41Z,2021-02-18T19:05:13Z,2,2,MERGED
paragon,[WIP] Create analyze-dependents.yml,https://github.com/openedx/paragon/pull/637,2021-02-17T21:42:03Z,2021-03-24T16:54:30Z,1,19,CLOSED
paragon,docs: update DataTable docs to reflect current state,https://github.com/openedx/paragon/pull/636,2021-02-17T13:20:40Z,2021-02-17T14:40:03Z,2,1,MERGED
paragon,fix: remove errors related to PropType table,https://github.com/openedx/paragon/pull/635,2021-02-16T22:48:10Z,2021-02-17T17:07:24Z,2,1,MERGED
paragon,feat: make TableFooter more composeable,https://github.com/openedx/paragon/pull/634,2021-02-16T18:45:10Z,2021-02-18T14:38:26Z,5,2,MERGED
paragon,fix: cleanup testing noise,https://github.com/openedx/paragon/pull/633,2021-02-13T06:35:21Z,2021-05-19T17:04:00Z,0,1,CLOSED
paragon,feat: data table upgrade,https://github.com/openedx/paragon/pull/632,2021-02-12T19:34:51Z,2021-02-12T19:42:00Z,2,1,MERGED
paragon,[AA-304]  change modal close icon from font awesome to paragon close icon,https://github.com/openedx/paragon/pull/631,2021-02-11T23:17:55Z,2021-02-12T14:03:52Z,2,1,MERGED
paragon,feat: add foundational modal components,https://github.com/openedx/paragon/pull/630,2021-02-11T16:30:39Z,2021-02-16T15:44:32Z,13,20,MERGED
paragon,docs: make nav and layout work for mobile,https://github.com/openedx/paragon/pull/629,2021-02-10T19:48:20Z,2021-02-11T16:16:03Z,3,5,MERGED
paragon,Refactor data table to use context,https://github.com/openedx/paragon/pull/628,2021-02-10T19:10:59Z,2021-02-12T17:55:18Z,27,18,MERGED
paragon,docs: improve the props tables,https://github.com/openedx/paragon/pull/627,2021-02-10T17:06:37Z,2021-02-10T18:46:57Z,4,6,MERGED
paragon,fix: sheet css theming and example updates,https://github.com/openedx/paragon/pull/626,2021-02-10T16:28:43Z,2021-02-10T19:39:42Z,2,1,MERGED
paragon,feat: new sheet component,https://github.com/openedx/paragon/pull/625,2021-02-09T19:29:28Z,2021-02-09T23:24:05Z,10,7,MERGED
paragon,feat: add sized containers,https://github.com/openedx/paragon/pull/624,2021-02-09T19:22:21Z,2021-02-09T21:10:37Z,4,4,MERGED
paragon,DropdownFilter and MultiSelectDropdownFilter,https://github.com/openedx/paragon/pull/622,2021-02-08T15:27:01Z,2021-02-10T14:27:53Z,6,9,MERGED
paragon,"feat: dependency injection of analytics from external packages (e.g., frontend-platform)",https://github.com/openedx/paragon/pull/620,2021-02-06T20:45:46Z,2021-11-01T20:48:35Z,12,3,CLOSED
paragon,feat: add additional avatar sizes,https://github.com/openedx/paragon/pull/619,2021-02-05T20:07:41Z,2021-02-05T21:08:32Z,2,2,MERGED
paragon,feat: add additional typography styles,https://github.com/openedx/paragon/pull/618,2021-02-05T19:52:11Z,2021-02-05T20:59:58Z,3,8,MERGED
paragon,fix: get rid of prop-types error,https://github.com/openedx/paragon/pull/616,2021-02-04T18:17:56Z,2021-02-04T18:38:22Z,2,1,MERGED
paragon,feat: checkbox filter,https://github.com/openedx/paragon/pull/615,2021-02-03T21:02:58Z,2021-02-05T20:38:04Z,9,13,MERGED
paragon,feat: CardGrid to organize collection of cards in responsive grid,https://github.com/openedx/paragon/pull/614,2021-02-03T12:49:59Z,2021-02-03T22:38:56Z,7,12,MERGED
